id,text,label
d_1001_03,"No se trata de racismo, se trata del hecho de que tenemos el derecho a la paz mental.",1
d_1002_01,"A ver yo no soy racista no , pero me gusta el ORDEN así que cada uno a su país.",1
d_1008_01,"Se me ocurre también que, tal vez sería justificado el cerrar ese centro de MENAS y empaquetarlos  sus respectivos países.",1
d_1009_01,"Pablo Iglesias y sus secuaces podían albergar a MENAS, y ellos los apoyan tanto... y tan poco hacen de los estragos que causan a la gente a pie.",1
d_1010_01,"Me pregunto, ¿qué contribuyen estas personas en este país?",1
d_1015_01,"Pues nada señora... ahora vaya usted y le pone la otra mejilla, pero eso sí, no se le olvide llevar el móvil encima o algún objeto de valor, estamos ya tan acomplejados frente a esta ""gente"" que hagan lo que nos hagan nos parece poco, ademas ¿ porque ir aclarando que la denuncia ""no es por racismo "" ?,",1
d_1018_02,"Esos menús violentos, los llevas a casa, dijiste que eran tuyos...",1
d_1018_03,"Los alimentas, los cuidas, y buscas un guardaespaldas, no defraudes tu casa, o algo peor.",1
d_1018_04,Ya ves lo ocurrido a las muchas personas atacadas por ellos...,1
d_1021_03,"pues no estoy de acuerdo que esa gentuza esté en nuestro país mantenida con nuestros impuestos, ayer pillaron a un Nigeriano que estafó en paguitas más de 80.000 eurazos en el País Vasco, claro, si hubiese sido español ni un dura percibía...!!!",1
d_1025_01,"¿Por qué los españoles votamos a partidos que, lejos de tener la intención de atajar por lo sano y con contundencia toda la delincuencia que han traído los extranjeros, pues éste sólo es el enésimo caso más, lo que hacen es mirar para otro lado ante lo que ocurre en nuestras calles, e incluso defender a estos extranjeros y acusar de racistas a los españoles que protestamos?",1
d_1028_01,"VOX no quiere este tipo de inmigrantes, VOX quiere gente trabajadora que respete nuestras leyes y nuestras costumbres, VOX quiere que a estos delincuentes los mantenga su país.",1
d_1030_04,"El no hacer nada, es lo que hace que esta gente se crezca.",1
d_1030_05,No tengáis la menor duda de que en Batán como en muchos otros sitios la situación va a ir a peor porque el encargado de arreglarla se pone del lado del delincuente y se esfuerza en hacernos creer que somos nosotros los culpables insinuando que somos racistas.,1
d_1031_01,"Para no cometer delitos, estos jóvenes necesitan claramente una página, como se ha hecho durante muchos años con otros.",1
d_1031_03,Y con alojamiento gratis.,1
d_1032_01,"No es racismo, sino que van a su país, sí.",1
d_1033_01,Es una pena que no puedas ir a dar un paseo porque tienes miedo.,1
d_1033_02,Estos menores son criminales asesinos de mañana.,1
d_1041_01,"Expulsión ya, o políticos que lo toleran fuera.",1
d_1045_03,"Mientras tanto otro barrio atemorizado por la inmigración ilegal, violenta y con delincuencia asociada.",1
d_1049_01,"Ningún gobierno tiene el derecho de poner a la gente en nuestro país a violar, robar y asesinar a los españoles y todos pagados con el dinero de los impuestos de las víctimas, porque aquí en realidad, lo que está sucediendo es que los primeros políticos que deben estar en la cárcel son los políticos que acogen y protegen a los criminales y son cómplices en sus crímenes, porque los alientan y subvencionan.",1
d_1054_01,"ESTE GOBIERNO NO CUENTA LO QUE NOS CUESTA A LOS ESPAÑOLES DEL DINERO QUE PAGAMOS EN IMPUESTOS, MANTENER A ESTA PANDILLA DE MENAS QUE LA MAYORÍA DE ELLOS VIENEN SABIENDO QUE LES VAMOS A MANTENER A CUERPO DE REY Y CON UNA PAGUITA POR NO HACER NADA BUENO SOLO EL MAL.",1
d_1054_03,¿Se ha interesado Europa en saber algo sobre esta pérdida con el fin de imponer medidas para garantizar que el dinero no se dañe en este pueblo?,1
d_1059_02,"Hay inmigración legal, integrada y muy necesaria.",1
d_1060_01,Y ayer salió la noticia de un nigeriano que ha tomado más de 80.000 euros en paguita que ni siquiera le correspondía hacer otra tarjeta nigeriana.,1
d_1060_02,Y todo eso en 10 años mientras que el.que ha trabajado y se queda en paro tiene un máximo de dos años de cobrarlo y encima mengua con el tiempo.,1
d_1065_01,"La mentalidad progresista de esta señora, que es que la víctima pide perdón a los dos criminales porque ha tenido que describirlos, es increíble, pero insiste en que tal descripción no se debe al racismo y que tampoco los criminales deben trasladarlos a su país de origen y que sus crímenes deben continuar aquí en otros cuellos mientras no sean ella y su querida hija Marta.",1
d_1070_01,Yo sí quiero que se vayan (o los expulsen) a su país con sus padres y con su rey.,1
d_1080_02,"Si no somos capaces de dárselo, obligatoriamente debemos devolverlos a su país.",1
d_1083_01,"Con un buen palo, los conozco muy bien y sé que son cobardes.",1
d_1085_01,"Esto solo se arregla votando , al partido que diga que seran expulsados",1
d_1086_01,"«Hay jóvenes que están con el pegamento todo el día y necesitan tratamiento», prosigue la convaleciente, aterrada por el grado de agresividad sufrido.",1
d_1090_01,"No tenemos porqué justificarnos, esta gente simplemente sobra como sobran los progres que desvían el tema hacia el racismo en lugar de hablar de que esta gente es conflictiva y que la solución que proponen es fallida.",1
d_1091_05,"salen muy caros, y aquí tenemos mucha gente pasándolo mal cuyos padres y abuelos se han deslomado.",1
d_1099_01,"Lo primero, mena o extranjero que cómete un delito, expulsión inmediata.",1
d_1106_02,"2.- Yo no pienso ni pensaría que esos ""pobres chavales"" necesitan comprensión y contención:",1
d_1106_03,Son criminales.,1
d_1107_02,"""No hay menores, ni niños, ni refugiados...",1
d_1107_03,"hay ue ponerse muy serios con este problema  y exigir la expulsión de todos ellos , que las fronteras tomen las medidas necesarias para evitar que entren , que las onegetas   desaparezcan , son las causantes del problema ...",1
d_1107_04,"hace poco , las TV progres emitían un vidio del trato que reciben los menores por no cumplir las normas , de los delitos  las TV no se pronuncian ...",1
d_1107_05,"Hace unos días, hablamos de las estafas que cometen los inmigrantes cuando solicitan ayuda, recientemente, por robar otro teléfono, una persona fue asesinada...",1
d_110_02,Dicen lo que les conviene sabiendo que su audiencia en gran parte carece de la más elemental cultura.,1
d_1113_02,"Han pasado penurias, han robado y han hecho de todo para poder salir de Marruecos y seguir haciendo lo que en Marruecos aquí, pero sin impunidad.",1
d_1114_01,Corrijo su último concepto:... pero CON IMPUNIDAD.,1
d_1117_01,¿Así que tenemos que vigilar dónde están estos terroristas?,1
d_1118_08,"No han jugado sus vidas para vivir como nacieron, quieren hacer lo que quieran y aquí están permitidos por la ley del niño.",1
d_1120_03,"Y no te defiendas ni les hagas ningún mal, estando en tu derecho.",1
d_1125_01,"Lo que es ridículo es dar protección a delincuentes ,se tenía que expulsar a esta gente que su forma de vida en su país era robar y aquí se les trata mejor",1
d_1128_02,"Señora, ha sido estrangulada, no se justifique, y sí, esa gente a su país.",1
d_1132_01,Y no los quiere de vuelta a sus países.,1
d_1133_01,“Pobres niños inmigrantes” que apuestan sus vidas para entrar en otro país donde se les da todo y se les mima y a cambio siguen cometiendo crímenes como el país del que provienen pero con más beneficios.,1
d_1133_03,"Eso si, de la delincuencia de los inmigrantes poca información en los medios porque somos muy “racistas” pero si el delito es cometido por españoles, la nacionalidad va por delante.",1
d_1134_01,Esto cualquier dia explotara abra algun espańol que todavia tnga valor y se montara una muy gorda pero mientras les regalemos cosas y los dejen robar seguiran liandolas.unos menores y tienen al pueblo asustado pero donde se vio,1
d_1138_02,Esos otros son alimañas y 0.,1
d_1139_01,"La verdad es que no me explico que una persona a la que han podido extrangular y perder la vida por un telefono movil todavia se apiade tanto de quien por poco le ha podido provocar la muerte, dice que los pobrecitos ""están metidos en un centro como cabras"" sera ese el problema verdad, pues que curioso que viviran tan mal que lo que es voluntariamente ninguno quiere volver a su país, creo que no nos equivocamos si ademas con las ayudas que reciben y la impunidad con la que delinquen libremente, inviten a mas amigos a venir a España, el dueño del centro encantado por que ya tiene una cama mas llena con la que seguir cobrando el sueldo.",1
d_1143_01,¿ Me pregunto si esta victima pensará lo mismo el día que estos individuos agredan sexualmente a su hija o nieta ?.,1
d_1143_02,Supongo que como es tan buena comprenderá la violencia de estas personas.,1
d_1144_01,"Valla, a juzgar por la misericordia de la victima lo mismo la pobre mujer piensa que la solucion pasaba por comprarles un piso y darles un trabajo como el suyo, seguramente...",1
d_1144_02,"Mejor los devolvemos a su país de origen, los reservamos como criminales prohibiéndolos la entrada para siempre y cerramos el bar donde viven con impuestos pagados por todos los que sólo sirven para importar delincuentes comunes y vivir de la subvención por la ""cargo que tienen de ellos""",1
d_1146_03,"Lo que sufre esta gente por tener a la banda criminal MENA, no sólo en el Batán sino en mucho otros sitios, no lo denuncian los buenistas, que por otra parte, los podían meter en sus casas.",1
d_1146_04,"Y sí, déjenlos ir a sus países, dejen que sus gobiernos los cuiden.",1
d_1149_02,"Inmigración sí, pero inmigración constructiva que participa en el desarrollo del país de acogida.",1
d_1149_03,Lo que no puede ser es que la entrada de inmigrantes está sin ningún tipo de control.,1
d_1149_04,"Los españoles tambien hemos emigrado a Alemania en los 60, pero allí se iba a trabajar y a respetar las leyes del pais.",1
d_114_01,¿Pero no son los terroristas musulmanes?,1
d_1151_02,"Como si no fuera suficiente para los elegidos en las urnas, que no saben a dónde los llevan los partidos, se suman a todas las tropas de todos estos ""turistas"" que nos invaden, que entran ilegalmente en España, se alimentan, algunos si no todo su dinero para pegamento, y a la calle para ver que cae, pero también como ellos ilegalmente.",1
d_1151_03,Y la justicia los protege con su bendita e intocable Ley de los Niños.,1
d_1153_02,"Si son menores la institución que los custodia debe responder por ello y creo que todo acto criminal debe ser juzgado y castigado y si los que lo cometen no son nacionales deben ser extraditados a su país, sea el que sea.",1
d_1155_02,No tengo ninguna gana de que me estrangulen a mí o que le vuelvan a estrangular a Ud.,1
d_1156_01,Yo los expulsaba pero en una caja de pino,1
d_1157_03,"Bueno, por supuesto que no es, señora, no es racismo, lo que pasa es que les hicieron creer que si lo es, e incluso lo han grabado a la derecha cobarde, y eso es que tienen que ir a sus países, sí o sí, y no hay más.",1
d_1158_01,"asi que no quiere que se marchen y no entiende porque estan asi los menas , a ver si va a necesitar otra ayudita para  decidirse, ya me dira usted para que los quemos aqui, si tanta necesidad tiene de hacer caridad acritas esta muy necesitada,  lo que tienen que hacer es deportarlos a todos aqui ya tenemos vastante con los nuestros.",1
d_1163_01,"Decía la agredida “ Lo primero que quiero dejar claro es que no se trata de racismo ni queremos que estos chicos se vayan a su país», manifiesta la víctima“",1
d_1163_02,"Porque sí quiero que vayas a tu país y comas pegamento o arena en tu tierra, ¡¡porque aquí estás TORBANA!!",1
d_1167_01,"Gracias a Podemos y al Psoe, España está entrando en lo mejor del exterior...",1
d_1168_01,"Bueno, lo siento, pero me pregunto cómo son esos criminales en España... al menos fuera de una prisión.",1
d_1174_01,"Vaya estos MENAS, a los que la izquierda defiende y nos los quieren meter en casa, en la nuestra no en la de ellos, por supuesto, no son tan buenos como proclaman,  la ley del menor es una ley que solo se preocupa de los criminales y las víctimas no les importan nada, esto es de sobra conocido por estos delincuentes que saben que hagan lo que hagan no les va a pasar nada, entran y salen de los Centros de Menores, como Pedro por su casa, nos gastamos un dineral con ellos, con lo sencillo que sería mandarles a su país, Marruecos.",1
d_1174_02,"Pero bueno como somos tan guays pues nada nos los tenemos que comer, primero de menores y luego de mayores, paguita al canto y efecto llamada para que sigan viniendo, a todos estos los mandaba donde viven estos politicos progres que tanto los defienden, y después de un tiempo les preguntamos que opinan entonces.",1
d_1176_01,"La solución efectiva que la víctima pide para este problema, como queda expuesto, no es que estos menores sean repatriados a Marruecos y que sea el estado marroquí, quien asuma la tutela y la atención de sus menores...",1
d_1176_02,"Ella, que ya es una víctima, manifiesta que no quiere que esos chicos se vayan a su país...",1
d_1176_03,"Que tanto su hija como ella, son conscientes de los graves problemas que sufren estos menores que deben ser tratados...",1
d_1176_04,"Es decir, de alguna manera minimiza el comportamiento de sus agresores y pide soluciones que, repito, no suceden porque estos niños son expulsados a Marruecos.",1
d_1176_05,"Como dice el refrán, la sarna con gusto no pica y si ella, de alguna manera ha querido justificar que estos chicos actúen así sin ser conscientes de lo que hacen y que la solución ocurre porque nuestro país, sigue gastando dinero y poniendo en riesgo la tranquilidad de los vecinos a la atención de algunos menores que son de nuestro vecino al sur...",1
d_1177_01,"Bueno, sí pedí que estas personas fueran devueltas a sus países.",1
d_1177_02,"Aquí no tenemos porque mantenerlos y dedicarles unos recursos que nos son totalmente necesarios para solucionar ese alto ""nivel de pobreza"" que los buenistas predican continuamente.",1
d_1180_01,Rocío Monasterio (VOX) invita a Díaz Ayuso (PP) a acompañarla para conocer la realidad que se vive en la calle con los MENAs.,1
d_1181_02,Los MENAS siguen generando inseguridad.,1
d_1181_03,Tienen que respetar las reglas básicas de convivencia o ser repatriados con sus padres.,1
d_1182_02,Mena (Menores Extranjeros No Acompañados): 664 euros/mes + habitación + comida.,1
d_1182_03,El Parlamento de Cataluña aprueba con los votos favorables de PP + C's la ampliación de las 'paguitas' para MENAS hasta los 23 años.,1
d_1183_02,"Y que también nos expliquen por qué no son devueltos a su país, que debe pagar los gastos y hacerse cargo de los daños causados.",1
d_1185_02,Bastantes de ellos infectados con el virus chino.,1
d_1185_03,"Siguen viniendo y el gobierno no hace absolutamente nada, únicamente pregonar las excelentes relaciones que mantenemos con marruecos.",1
d_1186_01,"Lo que sucede en España la inmigración sin control ni barreras y muchos se quejan amargamente es lo que los del partido democrático Biden, Obama, Pelosi para los EE.UU. y AbC (javi, David, Pedrito) proponen en cuerpo y alma.",1
d_1187_01,"Vamos a ver el progreso español, estas menas ya son criminales en Marruecos y muy a menudo drogadictos, que el vecino del sur nos envía a limpiar sus calles, y los capullos aquí los comen, no son personas que vienen a buscar un futuro mejor, pero aquí se les permite casi todo debido a las leyes que tenemos y lo saben.",1
d_1189_01,VICTIMA: «Lo primero que quiero dejar claro es que no se trata de racismo ni queremos que estos chicos se vayan a su país»,1
d_1189_09,Que regresen a su país del que nunca deberían haberse ido.,1
d_1189_10,"Y no, no es racismo (o si, no me importa) es una cuestión de orden.",1
d_1189_11,La mierda en el wc y la fruta en la nevera.,1
d_1189_14,"si, por supuesto pero es mi escoria y ya le buscaremos solucion, no hace falta multiplicarla por 100 y descontrolarla.",1
d_1189_15,Cierre de las fronteras YA.,1
d_1192_04,Parece que estos personajes según nuestros muy buenos políticos son los que pagarán nuestras pensiones con su trabajo.,1
d_1193_01,El Gobierno cuenta con más de 10.000 ciudadanos magrebíes (Menas) que deben regresar inmediatamente a su país.,1
d_1193_02,"Con el gasto social que significa mantenerlos, podrían aumentarse las pensiones más bajas de nuestro país.",1
d_1193_03,Basta de gasto social inútil.,1
d_1194_01,"Es justo que esos menores marroquís sean adptados por el sultán de Ma rruecos, que es muy rico y no por los contribuyentes de un pais empobrecido como el nuestro.",1
d_1195_01,"Cuando se les ve el 25 % de la ayuda que proporcionamos con los intereses de la UE se destina a las migraciones, ergo para apoyarlas.",1
d_1198_01,¿Dicen que no es racismo y no quiere que se vayan a su país?,1
d_1201_03,No se adaptan aquí.,1
d_1201_04,Han cometido crímenes.,1
d_1202_01,"Lo mejor para esos niños es que están con sus padres o que sus gobiernos se ocupan de ellos, ya tenemos suficiente con los nuestros.",1
d_1207_01,"Los mandan para librarse de sus problemas sociales  , los delincuentes juveniles para España",1
d_1211_01,Dos pensiones de pago más que tenían una rata gratis.,1
d_1212_01,No les va a pasar absolutamente nada.,1
d_1213_01,"Bueno, con un poco de comprension de la sociedad con sus costumbres (sexuales incluidas), una paguita de 800 al mes y un pisito de proteccion oficial, seguramente se reinserten y se lien a trabajar como animales para pagarnos las pensiones",1
d_1214_01,"O una buena okupacion, empadronamiento, a cobrar y estas cosillas para los extras...",1
d_1216_01,"Aunque los cojan, no lo van a pagar,...y seguirán viniendo mas, al socaire de nuestras laxas leyes,..",1
d_1217_02,"Los menores no acompañados que llegan ilegalmente a nuestro país deben ser devueltos a sus países con sus padres, y si no localizan a sus padres, deben ser devueltos a su país.",1
d_1218_01,Vamos a cazarlos.,1
d_1221_01,"Sra. Nuria, aunque supongo que será un nombre ficticio, usted no puede proteger y proteger el crimen, incluso si Soros lo dice, sus ONG los nuevos esclavistas y si se me permite incluso el Papa y esos jóvenes son criminales.",1
d_1222_04,"Mientras, entran gentes de natalidad descontrolada y sin problemas de subsistencia ya que corren a cargo del contribuyente...",1
d_1222_05,Hasta que se acabe el dinero y les convertirán en mano de obra esclava...,1
d_1223_04,"España es un país muy solidario, pero menos con los españoles.",1
d_1225_03,"Los menores, con sus padres o al consulado.",1
d_1226_01,No quiero que vaya a España.,1
d_1226_02,"No los quiero en España, y los quiero expulsados.",1
d_122_01,"No sé si los budistas se dedican a poner bombas, sólo las ponen en el nombre de Alá.",1
d_122_02,Si alguna otra religión predicara las barbarie estas personas dicen que también les prohibiría.,1
d_1234_01,Que majos nuestroh niñoh,1
d_1236_01,¿Qué acuerdo internacional te obliga a mantenerte en suelo español y cuidar a los inmigrantes sin papeles?,1
d_1242_01,Esas son algunas de las joyitas que nos llegan.,1
d_1242_02,Para estas personas no debe haber consideración y proceder a la expulsión inmediata del país.,1
d_1243_01,¿A qué esperas para expulsar o aniquilar a todos los criminales y criminales extranjeros?,1
d_1243_02,"Como si no hubiera turba local encima de tener que soportar a turbas de Marruecos, América o Rumania",1
d_1243_03,"Además de eso muchos bastardos (los verdaderos culpables de esto) comenzarán a decir que no hay culpa a los inmigrantes o algo así, los culpo por sus acciones, y si en algún país hay un criminal y violador español que lo expulsará de allí, incluso si es mejor que lo maten para ir a España.",1
d_1244_01,"Curiosamente las leyes feministas, ya que sobreprotegen a las mujeres al quitarles los derechos a los hombres y así se alimentan del problema de una desigualdad interesada que incluso defiende el ministerio de igualdad, suena como una broma si no fuera verdad, y frente al REAL problema de la inmigración ilegal con su cultura antieuropea sigue mirando hacia otro lado, algunos incluso poniendo etiquetas a los que lo hacen.",1
d_1245_01,"Sin una mano ultra dura, no cambiarán.",1
d_1245_02,Además de la impunidad se sienten protegidos por las leyes,1
d_1248_02,"¿La creación de una ""ley de violencia migratoria"" que castigue más severamente los delitos cometidos por extranjeros?",1
d_1257_03,"Lo normal es deportarlo tras la condena, o que la cumpla en su país de origen y con prohibición de entrar en el país durante años, vamos como ocurre en muchos sitios.",1
d_1263_02,"Si no les gustan nuestras normas sociales, un pequeño viaje cultural a sociedades como la República Turca o Centroafricana, pueden abrir sus mentes.",1
d_1264_02,Una cosa es una MENA que todos sabemos que Alauita reinó para pertenecer a que nunca voy a entender porque no los liberamos en la frontera y algo más es un adulto.,1
d_1267_01,"Tanto para hablar de fascismo y fascistas, pero sólo de portavoz o papel mojado, en otro momento saldrían de la depresión y colgarían a estos bastardos de los árboles.",1
d_1271_02,son conocidos los miles de españoles que acechan en parques para violar quinceañeras y golpear a sus familiares que los defenderán... oh espera...,1
d_1273_01,"Yo me iba a preguntar qué cojones hacían tres súbditos del Reino Alahuita emborráchandose, agrediendo brutalmente a vecinos con palos y muletas y abusando sexualmente de una niña menor de edad;",1
d_1274_01,4 para mí todo marroquí :-(,1
d_1276_01,"acá tenés delincuentes españoles si querés, pero en este caso los tratan de ""personas"" o ""ciudadanos""",1
d_1289_01,"Lo repulsivo es que sólo se envían y votan noticias sobre criminales extranjeros, pero no sobre criminales no extranjeros a pesar de que representan el 70% de la población carcelaria y cometen muchos más delitos, por lo que hay muchas más noticias sobre tales crímenes cometidos por no extranjeros que cometidos por extranjeros, pero siempre se envía y vota el segundo.",1
d_1289_02,"Eso sí que es repulsivo: diferenciar según la nacionalidad para ocultar los delitos cometidos por españoles o incluso negarlos (en el caso de las violaciones o la violencia de género, si los acusados son españoles todo son siempre denuncias falsas para vosotros), mientras que los de los extranjeros alcanzan portada como un cohete sin que os acordéis ni por un segundo de la presunción de inocencia de los acusados.",1
d_1289_03,Y a veces incluso asumiendo que son inmigrantes aunque no se diga en las noticias.,1
d_1289_04,"Por supuesto, cuando dices que lo son, y cuando no lo dices es porque ""quieren ocultarlo"", conclusión: todos los criminales son extranjeros.",1
d_1290_02,Expulsión y prohibición de entrar en España de por vida.,1
d_1290_03,"Yo soy rumano y estaría encantado si expulsan a los rumanos que delinquen, incluso delitos menores o hurtos.",1
d_1290_04,¿Por qué crees que los gitanos rumanos están casi todos en España o Italia?,1
d_1290_05,Básicamente porque la ley aquí parece hecha para la guardería.,1
d_1312_01,No hemos recibido una importación de psicópatas sino de delincuentes profesionales que usan las leyes de protección al menor para delinquir y poder seguir delinquiendo.,1
d_1312_02,"Se da la circunstancia de que son marroquíes, pero no es ese el problema sino la ley que lo permite.",1
d_1314_03,"El error es que no se hace lo que es realmente mejor para el niño, que es esposarlo, drogarlo, y ponerlo en un avión para llevarlo a casa donde su gobierno o su familia sabrán cómo darles un futuro mejor que el de un criminal.",1
d_1316_02,Los extranjeros delinquen mas.,1
d_1323_10,"Si esto se hubiera hecho x “español”, mañana las redes se quemaron y las manifestaciones al suelo.",1
d_133_01,Declaramos ilegal el Islam en suelo europeo y a cualquiera que no le guste ir,1
d_1340_02,"Además, los cuerpos policiales han informado al juez de la presencia de un grupo muy numeroso de árabes, entre los que se encuentran los detenidos, que están generando muchos problemas.",1
d_1346_02,Claro q es grave y en mi comentario lo he indicado y por eso perdió el gobierno pero creo q en esta noticia hablar de m. Rajoy carece completamente de sentido la verdad (esta noticia habla de unos extranjeros q acosaron a una niña en un parque),1
d_1352_01,"No te olvides del Juzgado del español, donde sólo se juzgarían inmigrantes, a los que se les aplicarían unas leyes especiales y más duras que sólo se aplican a casos en los que un malvado inmigrante agreda a un español.",1
d_1354_01,"No lo he calculado, pero te puedo garantizar una cosa: el porcentaje de asesinatos ""machistas"" cometidos por extranjeros es muy superior al porcentaje de extranjeros en España, más del doble, y creo que si me mojase diciendo que el triple aún me quedaría corta.",1
d_1365_02,Si un 30% de la población reclusa es extrangera siendo esta un 12'9% de la población española..,1
d_1366_01,"No seas racista, son sus costumbres y tienen que ser respetadas.",1
d_1367_01,"No te importa una mierda, te importa la gente, que en un porcentaje son criminales.",1
d_1369_01,Que hay más mierda entre los inmigrantes que inventas.,1
d_1369_02,Yo digo que nos deshagamos de los que cometen este tipo de crímenes.,1
d_1369_03,"La gente de bien, que siga viniendo, yo encantado, no he tenido un problema con un inmigrante en mi vida.",1
d_136_01,"Encajan muy fácil. Los salafistas, wahbitas, radicales... tienen otros enemigos, a parte de occidente.",1
d_1370_01,"Ah, pensé que estabas hablando de detener la inmigración, porque la ley ya ha previsto la expulsión de inmigrantes criminales desde 2015.",1
