id,text,label
d_1820_01,"Hemos visto en las noticias en Alemania como ""refugiados"" tomar un vuelo en Dubai, llegar a Bielorrusia y luego cruzar Polonia para llegar a Alemania, Holanda o Suecia, uno de ellos hace una película para las redes sociales mostrando que es difícil pero entonces la vida es más fácil, y es real, son en estos países los primeros beneficiarios en obtener vivienda social mientras que otros esperan en una lista durante años, las casas que antes eran por estudiantes también están destinadas a estos miles de oportunistas, y vienen a mostrarnos su cultura, su ideología, sus costumbres, la desinteligencia de nuestros políticos no es casual y nuestra culpa por elegir mal, pero lo peor serán nuestros hijos y nietos.",1
d_1821_01,"Para cuando la expulsión inmediata  de los ilegales estos, m...da de políticos.",1
d_1822_01,Nuevos pagos para disfrutar del sistema de ayudas españolas abonadas a expensas del contribuyente.,1
d_1823_02,"Y preparar prisiones como marroquíes, robles y pan y agua",1
d_1826_01,"La noticia se ha difundido en marroquíes que aquí pueden violar a quien quieran y darles un cheque de pago, es normal que incluso simulan emergencias de salud para entrar.",1
d_1829_01,"este delito en USA sería castigado entre 20 años y perpetua, en españa les darán casa y pensión",1
d_182_03,"Del mismo modo, no puedo criticar a un marroquí por ser marroquí, pero sí puedo criticarlo por ser salafista.",1
d_1830_05,"Esta mañana han hablado de detención del supuesto enfermo por ""favorecer la inmigración ilegal"" pero nada más.",1
d_1836_03,Pero en cambio pasa con un gobierno progresista y todos los progres sosiatas animan al gobierno a que les den casas y paguitas a los ilegales y ademas le hacen la ola a Marlaska.,1
d_1839_02,"No te traten como criminales, pobrecita.",1
d_1842_02,"Mientras la gente de Palma pasa por allí canutas, el conglomerado inmigracionista se vuelve ilegal con cada vez más profusión en las Islas Canarias.",1
d_1853_01,"Yo añadiría,  donde todos echan lo que no quieren en sus países.",1
d_1856_01,"A lo mejor a los que se escaparon irán a celebrar algúna fiesta con ALGUNA MENOR EN GRUPO, ya me ENTENDEIS.... o a CLAVAR CUCHILLOS POR LA ESPALDA cuando lleguen a CEUTAA....",1
d_1865_01,"España es para los moros un país mejor que su paraíso donde sólo hay 20 vírgenes y en España hay muchas más, y el resultado legal será una paga y nacionalidad y puede ser más subvenciones.",1
d_1865_02,Es eperfecto para las manadas de moros,1
d_1866_02,"Nos engañan como quieren, nos falta gobierno, justicia...",1
d_1866_03,nos invaden como quieren .,1
d_1867_01,¿Pero tienen una pagita o no?,1
d_1868_03,"Expulsión de todos los inmigrantes indocumentados, fríos o calientes!!!!!!!!",1
d_1868_04,"¡Estos no vienen a pagar pensiones, están terminando con fondos públicos!",1
d_1870_02,"Así, todos los ilegales votarán contra los que trabajan, que cada vez serán menos,porque todos querrán vivir del subsidio estatal.Y",1
d_1871_02,¿Tenemos derecho a pensar que pueden ser terroristas?,1
d_1873_01,pues nada papeles para todos,1
d_1881_01,"en vista de que esto va a ser una avalancha de vuelos desviados, la organización de aviación mundial de la IATA y la propia UE deberían prohibir a los vuelos marroquíes volar a través del espacio aéreo europeo, bloqueo total",1
d_1885_01,"Saben ya que pisando suelo español, este gobierno no puede o no quiere aplicar la ley de extranjería y, por tanto, ni son devueltos, ni son expulsados y, por consiguiente, se quedan en nuestro país.",1
d_1886_01,"Y ahora que socialistas, les vais a dar los papeles a todos, y nos vais a robar nuestro dinero al pueblo, para mantenerlos.",1
d_1890_01,"En el aeropuerto pasé el control con las llaves, las alarmas estaban encendidas, les mostré las llaves, las dejé en la canasta, pasé de nuevo, no volvieron a sonar, pero me pasaron la porra de metal, es porque yo era español, retirado y Bilbao, si hubiera sido enemigo de Santiago, el caballo, no me hubieran molestado.",1
d_1891_01,"Por fin ABC llama correctamente  a los moros que se escaparon del avión: ""Inmigrantes Ilegales"".",1
d_1902_01,Y las violaciones.,1
d_1905_02,"Según su libro, la ""tierra del Islam"" debe ser para la eternidad, para recuperarla es un deber sagrado.",1
d_1907_01,"El gobierno está con los invasores, como en 1812.",1
d_1908_01,"Sólo esos eran franceses, y estos moros.",1
d_1909_06,Sólo aquí hay todo gratis Pagar sin trabajo Hogar social Agua y gas bono Escuelas de medicina Alimentación Libros dentistas,1
d_1911_03,Solo falta que secuestren aviones para venir Y se les permita,1
d_191_04,"¿Es sentido político común no ser legislado, y ser permitido vestirse en el Occidente propio de otras épocas, culturas y climas, como de costumbre?",1
d_191_05,"La altura, ya vista incluso en el público y creer es su derecho, en el caso de la mujer también su uso los degrada - y ellos son los que más los utilizan -, denota fanatismo y poder dogmático de creencias irracionales, y más para los hombres que imponen ese ""modo"" - no lo utilizan tanto - o ritos y costumbres anclados en el tiempo, y sin evolución.",1
d_1921_01,"Los palos son los que reciben en su país, por eso vienen.",1
d_1923_02,¡No van a matar a todos!,1
d_1923_03,Con el Coran en la mano.,1
d_1928_01,Fuera ya con todos coño!,1
d_1928_02,¡Expulsión en masa!,1
d_1937_01,"Más pagas para inmigrantes ilegales, peligran las pensiones contributivas.",1
d_193_01,"Una medida lógica, justa y elemental, sería que no pudiera haber aquí más mezquitas que iglesias allí.",1
d_1942_01,"Estas multas, y a su país sin poder nunca pisar España",1
d_1943_01,"No solo llegan en Open Arms, ya vienen en vuelos chárter en primera.",1
d_1946_01,Debemos detenernos y luego revertir esta invasión.,1
d_1947_01,"El gobierno comunista y socialista quiere importar tantos ilegales como pueda, son votos futuros.",1
d_194_02,Seria se ha asegurado de que su lavor no fuera respetado fuera de su dominio la idea de que la reconquista es el fin principal de todas sus aspiraciones.,1
d_1953_01,"Siempre los marroquíes, que por cierto, ya son mayoría en muchos barrios de España.",1
d_1953_02,Por qué tenemos que mantener con nuestros impuestos a los ilegales?.,1
d_1958_01,"#10 Claro: si se encuentra con naves abandonadas y sin otro lugar para vivir, pues se mete en las naves abandonadas y trata de conseguir agua de donde buenamente puede.",1
d_195_02,"El salafismo equivale al yihadismo, si hubieran tenido un poco de cabeza nunca lo habrían permitido.",1
d_195_03,"De repente el salafismo debe ser prohibido por la ley, equivale a terrorismo.",1
d_1961_01,"¿En serio hay que creer que sufren muchísimo, y eligen venir a que les mantengan en el peor país del mundo, habiendo tantos por escoger?",1
d_1964_04,Hace más de un siglo sufrían la misma clase de discursos y situaciones de exclusión los italianos y los irlandeses en los EE.UU.,1
d_1964_05,"Pero han terminado bien integrados, a pesar de todas las dificultades.",1
d_1965_02,"Viven en donde buenamente pueden, y esperan que el sufrimiento actual se traduzca a largo plazo en situaciones más cómodas.",1
d_1968_02,Se lleva años pidiendo que se solucione esa situación porque es un foco de peleas y de robos en las proximidades.,1
d_1970_02,"De entrada, llegan aquí huyendo de ciertos países.",1
d_1970_03,Cosa que no quita que sus condiciones de vida aquí sean terribles.,1
d_1971_06,a) Los grupos que llegan aquí salvo los iberoamericanos y la gente de la Europa del Este uson de na cultura muy diferente.,1
d_1973_02,"Ayer por la tarde en una fuente pública, un senegales, fue a coger agua, según los compañeros que iban con él, aseguran que tenía la macarlilla puesta pero cuando se dispuso a beber le agredieron tres Jovenes que estaban sentados en un banco, hecho que no cuenta ningún medio.",1
d_1974_01,"Lo de hoy ha sido un estallido de rabia, que llevaba acumulándose durante mucho tiempo por motivos perfectamente comprensibles.",1
d_1978_05,Más de 40 han dado positivo y estás poniendo en peligro la vida de MUCHAS personas.,1
d_1980_01,"Con respecto al punto (a) del #_23, curiosamente los latinoamericanos también tienen innumerables quejas de las habituales, no hay nada más que ver los hilos de noticias relacionados con latinos que cometen crímenes violentos.",1
d_1980_07,"Mientras la desigualdad persista como brutal en el mundo, seguirá habiendo miles de personas que estarán dispuestas a arriesgar sus vidas para llegar a un país donde no viven tan mal como el suyo.",1
d_1980_08,"Evitar esas corrientes migratorias sin abordar el problema de la pobreza y la desigualdad sólo sería posible mediante medidas inhumanas y salvajes, como matar activa o pasivamente (por ejemplo, con minas) a cualquiera que intentara cruzar la frontera.",1
d_1985_06,"Han roto muebles de la calle, coches, un bar, pero los racistas son los otros, sí, señor.",1
d_1985_13,Más de 40 han dado positivo y ustedes están poniendo en peligro la vida de MUCHAS personas.,1
d_1985_17,"A los hijos de puta que les pagan miserias que también se les caiga el pelo, pero basta ya de defender a la gente solo porque son de otro color",1
d_1985_21,¿Hay que mirar el colo para justificar o entender la precariedad con la que viven?,1
d_1989_02,"Allí, sin acceso a la higiene o la privacidad, todos a los cuarteles y buscar en otro lugar.",1
d_1994_01,"Senegal es muy grande, pueden ir allí a rebosar todo lo que quieran.",1
d_1994_02,Aquí violencia cero. O a casita.,1
d_1994_04,O saben estar o a su casa.,1
d_1994_07,Nada justifica que rompan las reglas.,1
d_1995_01,aaaaaaaah bueno.. que se metieron con uno cuando iba a la fuente así que está justificado destrozar mobiliario urbano y lanzar piedras.,1
d_1997_01,¿Ser un esclavo y vivir en un barco si ni siquiera agua?... mi madre.,1
d_1999_01,"A Albacete vienen a recoger ajos, principalmente.",1
d_2000_01,Los desafortunados monos en la parte inferior de la jerarquía son atacados en repetidas ocasiones por quienes están más arriba en la manada.,1
d_2000_02,"A veces son golpeados todos los días, dice el primatólogo Frans de Waal, de la Universidad de Emory en Atlanta, Georgia.",1
d_2001_03,"Eso de defender a lo Podemos determinados grupos no porque lo merezcan, sino por serlo y asunir siempre que ellos son los débiles e indefensos, cuando muchas veces (o la gran mayoría) no es así y son generadores de peoblemas.",1
d_2001_04,Las famosas menas se extendieron y aprovecharon precisamente eso.,1
d_2009_03,"La culpa de todo esto recae en los líderes políticos, como son, hay que tenerlos en condiciones humanas adecuadas (luz, agua, inodoros portátiles, contenedores de basura).",1
d_2020_02,"Nosotros leyes para dar y regalar que cumplir, IBI, IVA ,IRPF, ITV, Cotizaciones Sociales, seguro obligatorio de vehiculos, IVTM, etc ...",1
d_2028_01,Actualmente España es la nueva Grecia en lo que a materia migratoria se refiere.,1
d_2028_02,Parece que los países europeos ya han olvidado cómo Grecia vio la llegada de millones de sirios y no de sirios.,1
d_2031_01,"Todos los partidarios de meter inmigrantes, antes de hablar metan a uno en su casa, despues de una semana, hablen, no lo duden, ¡metanlos en sus casas, en su vecindario, paguen vds sus paguitas y dejennos a los demas en paz!",1
d_2032_01,"Estos inmigrantes.. seguro vienen con desnutricións, anemias, piojos, varias infecciones y usted sabrá con qué enfermedades extrañas.",1
d_2032_06,Porque si los tienen es por su religión y su raza ¿no?,1
d_2035_01,Por caridad entra la plaga y esto es sólo un pequeño empleo.,1
d_2035_03,"Ya hemos visto lo que hay ahí fuera, en Afganistán y casi en todas partes, miseria económica y moral, una niña vale un puñado de cabras y nadie trabaja en el servicio doméstico porque es por eso que ya tienen a sus mujeres esclavizadas sin salir de casa, tenemos que defender nuestras sociedades para que trabajen y estén seguras, si están llenas de tercer mundo, ya sean inmigrantes o refugiados, lo que tienes es tu casa convertida en tercer mundo y se han dado cuenta de esto incluso en Escandinavia después de décadas de acoger refugiados y darles todo a cambio de nada que les haya sido devuelto con guetos, mafias, asesinatos, analfabetismo, fanatismo religioso, etc.",1
d_2038_02,"Esa gente viene sin ningún control, tampoco sanitario.",1
d_2038_03,"Traen el virus, lo cogen aquí o a saber.",1
d_2039_11,Todo esto fue logrado por sólo 4 millones de musulmanes de los 66 millones de habitantes de Inglaterra:,1
d_2039_12,Hoy en día hay más de 3.000 mezquitas musulmanas en Inglaterra._,1
d_2039_13,Hay más de 130 cortes de sharia musulmanes,1
d_2039_14,Hay más de 50 consejos de la sharia musulmana.,1
d_2039_15,"El 78% de las mujeres musulmanas no trabajan, reciben apoyo del Estado + vivienda gratuita.",1
d_2039_16,"El 63 por ciento de los hombres musulmanes no trabajan, son apoyados por el estado + vivienda gratuita.",1
d_2041_01,"No son inmigrantes, son invasores no deseados y hay que expulsarlos a la mayor brevedad.",1
d_2043_02,"Busque información sobre los violadores musulmanes de TELFORD con más de MIL NIÑAS DESTRUIDAS Y PROSTITUIDAS, por culpa de gente como Usted, buenistas apaciguadores.",1
d_2044_03,Y ser musulmán no es ser islamista.,1
d_2049_02,"La encuesta, de 615 páginas, revela que más de 100.000 musulmanes británicos simpatizan con los terroristas suicidas y con quienes cometen otros actos terroristas.",1
d_2049_03,"Además, solo uno de cada tres musulmanes británicos (34%) llamaría a la policía si creyeran que alguien en su entorno había tenido alguna relación con los yihadistas.",1
d_2049_04,"52 por ciento de los musulmanes encuestados dijeron que, en su opinión, la homosexualidad debería ser ilegal",1
d_2053_01,"Doña Alejo, ¿algo que aportar o viene sólo a tratar de apoyar a su colega el progre que no comenta sobre las violaciones, el apoyo al terrorismo, la violencia, el parasitismo de esos honrados ciudadanos que deseo que sean muy pronto sus vecinos?",1
d_2056_01,"Distribuirlos para Europa, entonces es darles lo que realmente quieren: vagar por toda Europa lo mismo que hicieron en su origen.",1
d_2059_01,Petra ¿A cual de todos? A lo que por ejemplo han dejado a sueltos y en libertad a 3 fénomenos (marroquíes( que en Mallorca violaron y torturaron a una chica?,1
d_2060_01,La devolución debe ser urgente y necesaria.,1
d_2060_04,Si a eso le añaden que el 58 por ciento de sus habitantes son de origen musulmán hacen peligrar la españolidad de la ciudad.,1
d_2060_06,"El colmo de la tontería era poner un hospital en la frontera con Marruecos, donde las parturientas marroquíes llegan para dar luz, obviamente la madre y la estancia nacida en la ciudad.",1
d_2061_02,Permiso de trabajo en origen y revisión médica obligatoria.,1
d_2062_01,Sigo sin ver claro qué trae de positivo dejar que entre gente en el país saltándose la frontera y dejando que hagan lo que les dé la gana.,1
d_2064_01,"Digamos las cosas como son , España es el único país del mundo que no defiende sus fronteras, están asaltando las vallas y las fuerzas de seguridad mirando, pues tienen orden del gobierno de no intervenir ¿ qué queremos?",1
d_2064_03,"Es lógico que todos vengan a España, saben que prácticamente en tres años se regularizaran por arraigo social , laboral etc etc porque es una regularización constante por la puerta de atrás, no lo tiene ninguna ley de extranjería de la UE.",1
d_2066_03,"¿que el de la foto y otros muchos iguales sin trabajo deberan ser mantenidos por el resto?,",1
d_2066_05,¿que si no tiene ayudas o trabajo tendra si o si que robar y okupar?,1
d_2066_06,"¿Y si el dueño del apartamento pagara por agua, electricidad... porque si no lo denunció por coacción?...",1
d_2066_07,¿que las subidas de impuestos son precisamente porque cada vez hay mas gente recibiendo que dando?,1
d_2066_08,"...y como trabajo para todos no hay nadie, porque no hay nadie... si ella tiene un trabajo, ¿te gustaría perderlo para dárselo a la de la foto, por ejemplo?",1
d_2069_01,"En los años 20 del siglo pasado, hace más de 100 años, ya existían este tipo de organizaciones y mira lo que han conseguido, engordar al monstruo que ahora ya nos devora.",1
d_2069_03,"La verdad es que viendo lo que se veía en las playas, para hacer teatro valen muchos de ellos, todo hay que decirlo",1
d_2070_02,Tras lo de ayer tambien he quitado la cruz de la renta para que no donen la parte correspondiente de mi irpf a ongs que fomentan el tràfico ilegal y la ocupación promovida por un rey infantiloide.,1
d_2075_06,Han entrado desde Marruecos y deben ser enviados a Marruecos.,1
d_2075_07,"La puerta se abre y Marruecos, para cuidar de sus hijos, de lo que es su responsabilidad.",1
d_2081_01,"Aquí tenemos a un ejemplo de los que asalta nuestra frontera, ropa, casa, paga y móvil para reírse de nosotros.",1
d_2085_01,"Tiró su alma, y antes de tocar el suelo, ya había robado uno de ellos.",1
d_2087_02,"A ver Menny en África son 1000 millones de almas, a principios del siglo XX eran solo 100 millones, es solo una cuestión de números y su población no para de crecer y crecer, en Europa no caben todos,",1
d_2093_02,"Les va el garbanzo en ello con tantos nuevos pobres a los que poder sacar el jugo y cobrar por gestionar su miseria,de lo que han hecho su profesión y principal fuente de ingresos.",1
d_2094_01,"Los únicos que quedan son tú y todos los que piensan como tú, eres como los romanos permitiendo que los bárbaros invadan Roma, y todos sabemos por qué Roma cayó y quién la rompió...",1
d_2096_01,"Pero que te gusta tomar tus diamantes su litio, fosfato, gas y más y más y más por 4 duros y mantener sus dictaduras para que no puedan evolucionar, este es el precio a pagar, estas personas buscan un futuro mejor en Europa y cuando vienen aquí uno saldrá adelante otro no tanto y otros criminales como muchos europeos, porque en Europa hay muchos inmigrantes y seguro que no están en tu casa fantasma y si a alguien le dan alguna ayuda es por acuerdos entre países y esos países del tercer mundo y cuando trabajan pagan sus impuestos como tú y yo y cualquiera y si son ilegales sin papeles ya los tendrán o si los devolverán, tu calma de que España se acerca al tercer mundo que no al primer mundo que estás listo y piensas que España trabaja gracias a ti, recuerda que tus abuelos o padres eran inmigrantes",1
d_2101_01,Y YO QUE LO QUE VEO ES ¿UN INMIGRANTE APROVECHANDO LA OCASIÓN PARA ARRIMAR?,1
d_2102_01,"Ni un céntimo a Cruz Roja, son los que más inmigración ilegal atraen .",1
d_2107_02,Ni un euro a estos.,1
d_2108_03,El mejor ilegal el que no llega,1
d_2109_01,"Por cierto que venga a mi ciudad y vaya dando abrazos asi a las muchas manadas de menas que atemorizan barrios enteros, menas y no tan menas, que pasee dando abrazos en algunos parques y calles de mi ciudad...a ver si luego piensa igual.",1
d_2115_01,"¡Eso es lo que creo, tienes que estar muy desesperado para arriesgar la vida de tus hijos!",1
d_2115_02,"La inmigración ilegal, por supuesto, es un problema, pero no puedo creer que haya tanta gente sin corazón y sin empatía.",1
d_2118_07,trabajando como un cabr.n y veo que no voy cobrar na...y esta gente viene aquí a gastos pagos...,1
d_2118_08,se van a un mando dinero de ésos y 500€ cada vez...te quedas con una cara de tonto,1
d_2125_04,me las pase canutas currando por el mundo palante...y viene esta gente a gastos pagos,1
d_2132_01,"A EEUU el inmigrante, además, va a trabajar.",1
d_2133_03,7.000 años han tenido y continúan con ese vagabundeo y matándose unos a otros.,1
d_2133_05,"También es la raza humana con la fuerza más física, es que esto no se entiende.",1
d_2133_07,"Se han acostumbrado a ser esclavos, puede ser que el continente sufra de un perpetuo Síndrome de Estocolmo.",1
d_213_01,aqui le damos una paguita al pobre negro de los cojones,1
d_2148_01,"Ciclo Superior de Integración Social  o sea, vivir de la subvención a partir de recibir a ilegales.",1
d_2158_01,"Lo único que me consuela (y me alegra al mismo tiempo) es que cuando vengan cortando brazos y cabezas, los de estos gi..p...llas serán los primeros.",1
d_2162_01,Pues a mí se me cae el alma al suelo al ver cómo solo se compadecen solo de ilegales e invasores.,1
d_2166_01,"Voluntaria de la cruz roja, no eres su mamá y te estás exponiendo peligrosamente a contagiarte del covid u otra cosa que a su vez puedes transmitir a gente de tu entorno.",1
d_2167_01,Los dirigentes pensantes de la Unión Europea les preguntarían: ¿qué podrían hacer con todos estos pobres?,1
d_2170_01,"Dentro de unos años estaremos llenos de España, chorizos, jinetes y pistoleros, ya que no damos una solución a todas estas tonterías.",1
d_2172_01,"Ceutíes que hoy no pueden abrir sus negocios o ciudadanos de bien que serán robados, acosados o en cuclillas en los próximos días aprecian el ""trabajo"" de esta pequeña perra que quiere llamar la atención",1
d_2174_03,"Lo que es imposible, es que nuestro país, JODIDO por los cuatro costados, con millones de parados, y cientos de miles de personas COMIENDO DE CÁRITAS cada día, tenga que acoger a miles y miles de inmigrantes, que se saltan las fronteras y la legalidad establecida.",1
d_2174_04,"Todo es muy bonito, pero esta gente quedará al albur de las MAFIAS en nuestro país, o danzando buscando un sitio dónde cobijarse - patada en la puerta-y algo que meterse en la boca.",1
d_2175_01,A lo tonto al final esta gente nos invaden.,1
d_2184_02,"Esta señorita bien se podria llevar a su casa a unos cuantos de estos menas,seguro que la acabarian de echar de su domicilio y saldria a cuatro patas",1
d_2189_02,"Pero existe un hecho objetivo: una persona cruza a nado 500 metros y llega a la orilla exhausta, quizá hambrienta, y arrastrando el dolor de una vida miserable.",1
d_218_02,Se metieron ellos y además a cambio de un pastizal y haciendo al puto asesino mafioso rico.,1
d_2190_02,"Yo creo que el 99,99 % de la gente que entraba era simplemente para encontrar trabajo.",1
d_2190_03,"Que la forma en que lo hacen sea ilegal y repulsiva, por supuesto.",1
d_2194_02,"que verás qué rápido se te borra ese vocabulario de ""empoderada"", menudo lenguaje de fulanas, menos mal que éstas no representan a la mujer española auténtica.",1
d_2199_02,"Yo soy partidario de que los devuelvan, más que nada, porque no cabemos todos, pero eso no me impide ver qué realmente se juegan la vida por un futuro mejor.",1
d_2201_01,"Indudablemente Mohamed aprovecha la miseria de esta gente como arma arrojadiza igual que Erdogan usó a los refugiados sirios contra la UE, en eso no vamos a discutir porque es obvio.",1
d_2207_04,"En otras palabras, no estoy a favor de la inmigración ilegal o clandestina.",1
d_2209_03,Y que hijo**** los que los usan como carne de cañón.,1
d_2211_01,¿Sabrá este muchacho que lo están utilizando deliberadamente como carne de cañón por intereses geopolíticos?,1
d_2215_01,La Cruz Roja... la misma que consiente estos ataques a nuestro país.,1
d_2215_03,"¿Cómo silencias las violaciones, la trabajadora no deja caer su alma con esas violaciones?",1
d_2219_01,La joven Luna debería buscarse un trabajo digno y productivo que no consista en parasitarnos y servir a la mafia globalista de tráfico de humanos y rendición y esclavización de Occidente.,1
d_2221_05,"Con la indispensable colaboración de pequeños parásitos hipócritas como esta niña, que por supuesto no responderá civilmente por cada crimen cometido por aquellos que pretenden entrar sin ningún tipo de control.",1
d_2222_03,"Este inmigrante se abraza desesperado a una mujer, a la misma a la que luego, por su educación y religión, despreciará por impura.",1
d_2222_04,"Las manadas más jóvenes vagan como no son devueltas (¿por qué?), las mismas manadas que más tarde cometen crímenes que la prensa ocultará.",1
d_2222_05,"Inmigracion si, pero contolada y con papeles.",1
d_2223_01,¿Sabe la PAVA si está abrazando a alguno de los Boko Haram con asesinatos y violaciones a sus espaldas?,1
d_2223_03,"¿Distingue a simple vista si es un sencillo chaval senegalés que sueña con jugar en el Madrid o un yijadista, o de las mafias nigerianas que prostituyen a sus compatriotas a paliza limpia?",1
d_2224_02,"30 millones nos han costado (por el momento) y nos ocupamos de la manutención completa de 2000 niños que están alejados de sus padres, y que, según la Convención de Derechos Humanos, van a regresar con ellos, el resto son leyes ilegales y secuestros.",1
d_2227_02,"Resulta que miles de españoles y yo que trabajamos de sol a sol somos los que pagamos estas acogidas con nuestros impuestos, no tú , guapa.",1
d_2228_01,Veamos Luna: cuando vas a tirar la lana al suelo es cuando esto se llena de gente que viene de modelos sociales que son incompatibles con nuestros valores.,1
d_2237_04,O es que tiene que ser negrito y venir del quinto c........ño para que a alguien se le caiga el alma a los pies??,1
d_2238_02,"Ahora que muestran las piedras que los ""pobres inmigrantes"" arrojaron a nuestra policía.",1
d_223_01,"No olviden que son sus costumbres, que no son olvidadas.",1
d_2242_01,"A esta atontada sin embargo no se le cae el alma ante una invasion de 8000 personas orquestada por Marruecos y sobre una ciudad soberana que es Ceuta, oleadas de gente de toda clase y sin mascarilla, un peligro publico y que ha obligado a los ceutíes a encerrarse en sus casas con miedo, sin poder muchos ir a trabajar.",1
d_2244_03,"Fuera de la cruz roja, sólo sirve para alentar la invasión y destrucción de nuestro país.",1
