id,text,label
d_1371_02,"Pues a ver si se ponen duros y empiezan a aplicarlo como dios manda, aunque hay que reconocer que la Policía en este país no tiene mucho margen de maniobra.",1
d_1384_02,"Lo dicho, expulsión inmediata.",1
d_1389_01,"Son los mejores, los más fuertes.",1
d_1392_03,Pero estos individuos se merecían que hubiera salido todo el barrio con bates y partirles la cara ahí mismo.,1
d_1394_01,"Si es morito, no hay crimen.",1
d_1396_01,"Hace un año y pico salió por aquí de cómo en un barrio de Murcia cuando los gitanos estaban dando por el culo a la 1 de la mañana con las palmas la policía local les decía ""que cerrasen las ventanas"" o ""durmieran con tapones"".",1
d_1396_03,¿Por qué marroquíes y argelinos tienen tantísima presencia en violaciones en grupo?,1
d_1396_04,¿Por qué esta gente siempre viene a nuestra cabeza cuando leemos noticias de esto y no tenemos chinos o italianos?,1
d_1396_06,"No hay que vallar el parque, hay que impedir inmigración tercermundista y musulmana. Punto.",1
d_1396_07,"Y a los que están hacerles superar un cursillo de integración, y el que no lo supere a tomar por culo.",1
d_13_02,Imagina un país como la India dónde hay millones de personas en castas inferiores que no protestan aunque los trates como ratas,1
d_1403_01,"A ver cuanto tardan en decir que se está lanzando una falsa sensación de inseguridad desde los medios, que estos jóvenes marroquies blabla...",1
d_1404_02,"Por otro lado, en este caso, un cierto grupo de agresores, con argumentos de mierda policorrectiva, clamando por sus derechos y obviando que también tienen deberes.",1
d_1404_03,"Vamos, hombre, si siempre son iguales, es escandaloso ahora.",1
d_1406_01,Asco de delincuencia extranjera.,1
d_1412_01,"lo mismo, pero apuntado la catapulta un poco más abajo, de modo que impacten en el muro, en vez de pasar por encima xD",1
d_1416_01,"Está viniendo lo mejor de cada casa para mejorar el país, sin duda alguna.",1
d_1418_01,"Diablos, es cierto que lo mejor y lo más preparado llegó.",1
d_1418_02,Tienes que tener un montón de fondos para violar a alguien y luego golpear a alguien más.,1
d_141_04,"La tolerancia debe ser compartida, y de no serlo, el casero pone las reglas y el visitante las acepta.",1
d_1421_01,"Díez años de cárcel sin ningún tipo de permiso y después, expulsión con prohibición de entrada al país",1
d_1425_01,"Vine a decir la misma cosa, suficiente mierda allí ya, para tener que preocuparse por ello.",1
d_1425_02,Deben ser enviados a sus tierras sin un billete de vuelta.,1
d_1426_01,"Es sólo que no entendemos que las chicas que van sin velo, con minifaldas o enseñando ""más que el proyecto de ley"", están clamando por ser violadas.",1
d_1426_02,Al menos en su cultura.,1
d_1426_03,"Y como estos individuos no han sido educados aquí, hacen lo que se les ha enseñado a hacer.",1
d_1426_04,"¿Qué, se anima a alguien a hacer talleres de igualdad para musulmanes en España?",1
d_1426_05,Para qué narices tiene que hacer un español un cursillo de igualdad si ya la hemos aprendido desde la cuna?,1
d_142_01,"A la mierda el Islam, ya si es una religión basura como todo, pero especialmente esto, debido a su contenido y la poca cultura y libertad de pensamiento de sus practicantes.",1
d_142_02,"Solo ha que ver videos de barbaridades de lo que en nombre de esa religión se hace en oriente medio, y no unos pocos ""locos"" sino miles y miles.",1
d_1433_01,"Pero algunos todavía tienen la manía de no decir dónde están los criminales ""para no estigmatizarlos"" mientras gritan ""el violador eres tú"" a cualquier hombre.",1
d_1438_01,La esposa izquierda de este sitio dirá que son víctimas del estado español... y que les damos una paguita y la nacionalidad española.,1
d_1440_01,"Circuito corto Buenosrollista, inmigrantes pobres contra chica agredida sexualmente.",1
d_1446_01,Es curioso que en un caso de violación o agresión de extranjeros metas con calzador la violencia machista.,1
d_1446_02,Pero cogiendo tu testigo diré lo siguiente: de las 22 mujeres asesinadas en 2020 ¿Qué porcentaje piensas que han sido asesinadas por extranjeros?,1
d_1449_02,"Además, los cuerpos policiales han informado al juez de la presencia de un grupo muy numeroso de árabes, entre los que se encuentran los detenidos, que están generando muchos problemas.""",1
d_1449_03,"Nada, fronteras abiertas y buen rollo, y quien diga que no, es hitler facha fasista",1
d_144_04,"¿Mis fobias? que un subnormal de estos lavados de cerebro por su ""líder religioso"" pondrá fin a la vida de personas que pueden estar contribuyendo con cosas a la humanidad y sembrar terror, sí, me asusta, pero no huyo de ella, si puedo acabar con ella.",1
d_1452_01,"Y a menos que podamos controlar la inmigración ilegal, que es de donde provienen la mayoría de los delitos contra las mujeres.",1
d_1453_02,"Porque mientras vamos, nos desharemos de Menis cuando nos hayan robado la cartera...",1
d_1459_02,"En otras palabras, le diría a la pareja que lo que asquea es el crimen en sí, no la nacionalidad del delincuente, ya que imagino que algún español podrá follarte a tu hija y golpearte.",1
d_1466_01,"Los inmigracionistas, delincuentes asociados SA, que gozan de prestigio en el entorno de políticos, medios, empresarios, islamistas, traficantes, etc. están muy dolidos por no haber cumplido con el sueño que se les brindaba de llenarnos de invasores ayudando y colaborando con una potencia o país extranjero, abiertamente hostil, a nuestra invasión, sustitución, saqueo, sometimiento e islamización por la que cobran y ya han recibido, por los menos de nuestro gobierno, un adelanto.",1
d_1466_02,"Digo, a cambio de dinero, como mercenarios vulgares, nos odian y quieren reemplazarnos, de lo contrario su negocio basado en la trata de personas fracasaría, siempre y cuando sus compatriotas engrosen las colas de desempleo y hambre, y mucho menos llenar los hospitales con la pandemia.",1
d_1471_01,"yo no puedo besar a mis padres , pero ésta individua que por lo que he liedo ni es enfermera, se puede restregar contra un ilegal",1
d_1476_01,"Y la inhumana, racista, sectaria y mala gente es seguir comprobando cómo somos insultados y amenazados por los medios de comunicación por criticar la actitud de ongs y otros gremios, que han sido irrigados con dinero público, para bailar, entre otras cosas, con inmigrantes ilegales disfrutando de la hazaña, porque nos consideran seres inferiores dignos de ser invadidos, saqueados, sometidos e islamizados, o eliminados con nuevas olas de pandemia, como sucedió en Huesca, Lérida y Valencia, alineados en las colas de hambre y desempleo, subiendo a las 6 de la mañana, o otra hora, mientras que el país del que vienen o nos dejan pasar no nos deja pescar, está comprando F16, helicópteros, drones y misiles de última generación, con los que nos ha envalentonado y chantajeado con la invasión de los mal llamados inmigrantes",1
d_1483_02,"Esta niña de 20 años, miembro de una peligrosa organización conocida como la Cruz Roja y junto a la cual la familia Corleone es una asociación vecinal de Praderrubias (Pontevedra), dando un magro espectáculo de bondad y compasión a otro ser humano (para algunos), con hipotermia, hambrienta y seguramente temida, es un traidor a la patria responsable y a los culpables de rebaños marroquíes que violan Cataluña, del libre funcionamiento de las menas a través de las ciudades, de la amenaza de la soberanía española, del crimen en las calles, de las mafias que se ven obligadas a entrar en el país y de que el Real Madrid quede en blanco este año.",1
d_1485_01,"¿Que te parece si Cruz Roja incrementara la lamentable y escasa comida -chorizo, lata y barra de pan- con la que despacharon a los Guardias Civiles o Policías Nacionales que eran salvajemente agredidos por los marroquíes?.",1
d_1487_01,"a gibraltar no van, a portugal no van, donde van ? a la chirigota de españa",1
d_1490_01,"Que le dé asilo en casa, sólo entonces aprenderá la lección de por vida, aunque la pobre chica puede tener secuelas psicológicas después de la violación.",1
d_1491_01,"esta chica, la cruz roja, el desgobierno expañol y todas las instituciones podían poner el mismo ardor en denunciar que el culpable primero de todo esto es el sátrapa rey marroquí y el segundo culpable la zurda apestosa expañola por llevar años incitando a que se jueguen la vida por un paraíso que no existe",1
d_1497_02,Es sólo un ejemplo para aclarar cómo algunos OnGetas viven de la trata de personas.,1
d_14_01,"No, creo que al radicalismo islámico se le está tolerando mucho más cuando suponen una amenaza mayor.",1
d_1501_02,"Por cierto, ¿cuántos de estos invasores africanos tienes en casa?",1
d_1514_01,"Cruz Roja, con todo el bien que ha hecho, y está haciendo, supongo, está dando una imagen de fomentar el llamado efecto, jugando el juego con mafias tratando con gente, personal poco profesional tomando fotos, bailando, fiestas, posible interés en subsidios.",1
d_151_02,"Y luego vienen con el rollo de la islamofobia, no es el Islam, son los marroquíes.",1
d_1522_01,"A ver que me aclare, ¿le da un abrazo a una persona que no conoce, que no sabe si está vacunado, ni si tiene alguna enfermedad?",1
d_1522_03,"Y luego cuando deje de abrazar a ese forajido, ¿adónde irá, para vacunarte de la COVID?",1
d_1526_01,Lo que estás buscando es lo que es largo para el negro de whatsapp.,1
d_1529_01,"En la defensa de las fronteras se trata de proteger la frontera, no de salvar a quienes la violan.",1
d_1529_04,"Nos invaden, no emigran.",1
d_153_01,"No serán denunciados por miedo, sino muchos otros porque, aunque no dan el salto a los terroristas, están a favor y se regocijan por sus acciones.",1
d_1549_01,"Si el negro trae el virus, la rubia puede rodar marrón,... o púrpura,...",1
d_1550_01,"Vete abrazarte con los menas de Ceuta o con los de tu barrio, pero sin mascarilla, y luego me lo cuentas, asi se te pasan las ganas de vomitar seguro.",1
d_1558_01,"Curiosamente, ninguna de las almas generosas y bondadosas que merodean por aquí ha citado el sufrimiento, el miedo, la desesperación, las heridas, lor robos sufridos por sus compatriotas.",1
d_1558_05,"Y junto a ellos están los aterrorizados Ceuthitas, y Meillenses, que no han recibido desgracia porque decidieron no invadirlo que habían sido invitados a hacerlo, no confiando en las consignas dadas a ellos.",1
d_1558_07,"Bobos que ante una accidente socorrerían antes a un negro que a un blanco, a un extranjero que a un compatriota, a (en algunos casos de esquizofrenia animalista) un perro o un sapo que a un ser humano.",1
d_1561_02,No he visto que los medios de comunicación no consigan ningún VOLUNTARIO de los Cruzados Rojos o Caritas dando una mano a la gente y las familias en las colinas de la habitación que tienen que ir y pedir que no se les deprive de hambre entre las personas que van a comer ayuda para ser extranjeros y que van allí por no dar la ayuda y no tener que cocinar o limpiar en casa.,1
d_1562_01,"No, lo que critica es la demagogia que ciertas personas hacen al usar ciertas imágenes para atacar al vecino, sin querer ver ni mencionar quien es el que se ha aprovechado de esa persona, le ha sacado todo su dinero y lo ha tirado al mar.",1
d_1566_01,"Vale, dos besitos, y que vuelva por donde ha venido,...",1
d_1568_02,"Ni somos responsables de que no estén bien de donde vienen, ni tenemos obligación de cambiar eso ni podemos atender a los miles de millones de desgraciados que hay en el mundo.",1
d_156_02,"Hay países en los que la única ""educación"" para los pobres es la coránica, con lo que no se saldrá del atraso y la ignorancia hasta que se consiga erradicar esto.",1
d_156_03,"Y entre estos países, cómo no, están Marruecos, Libia y Argelia, que son los que nos tocan más cerca.",1
d_156_04,"Por otro lado toca los huevos que haya un sistema público intentando formar a gente con valores sociales, modernos y europeos, y luego venga el Estado o Arabia saudi a poner pasta para los curas y las mezquitas.",1
d_1571_01,"Que hablas? Osea, a alguien que esta llorando desconsolado por que ha perdido a alguien intentando cruzar una frontera para llegar a un sitio donde se le ha prometido una cosa genial no se le puede ni abrazar? Ni intentar consolar?",1
d_1578_02,"Chica, estas personas han venido a quedarse y la mayoría de ellas podrían ser capaces de atacar a tu abuela en la calle mañana para robarle su bolso; porque son lo que son, una sociedad muy poco evolucionada que no se adaptará a la vida occidental y será un nuevo hipo del estado (repito, en su MAYORÍA).",1
d_1579_01,"viendo esta imagen me dan ganas de vomitar, es un monumento a la demagogia progre, si mañana a un español blanco le salva la cruz roja y te vas hacia la chica y le haces esto te denuncia la feministas por acoso sexual y saldria la carmencita calvo diciendo aquello de que todo lo que no es un si es un no y que es un actitud machista , pero como es un negrito se lo tenemos que perdonar y ademas nos tiene que parecer bien y abrir con ello el telediario, la chica esta que se lo lleve a su casa y que se haga cargo ella de los gastos de este tipejo, que aunque no lo parezca son los mismos que tiran cal viva a los policias en las vallas y son los mismos que os amedrentan de gorrillas o los que atacan violentamente a la policia municipal sino les dejan ponerse de manteros, que no os engañen estas imagenes que son pura gentuza, de cada 100 trabaja uno y los otros 99 estan dando problemas y ocasionando gastos.",1
d_157_07,"O islam o democracia, no existe eso de musulmanes demácratas, es solo un paso intermedio.",1
d_1580_02,"No se puede enfrentar como un ejército de soldados armados cuando se trata de una corriente continua de grupos de jóvenes, menores e incluso niños engañados, sin esperanza, que tratan de superar lo que se pone, o incluso con lo que se pone. La dureza debe ser del gobierno, para poner en marcha un país que ha demostrado una maldad que, afortunadamente, también está dando la vuelta al mundo.",1
d_1585_01,Vomitiva la versión progre de la invasión mora.,1
d_1586_01,"Qué imagen tan grosera de proteger la ilegalidad, las personas como esta son responsables de que seamos como somos.",1
d_1587_01,Vamos a ver como piensa desde que la violen tres o cuatro.,1
d_1591_01,Donde está tu empatía para ayudar a los de aquí,1
d_1601_01,A la cárcel debería de ir por cada uno de los delitos que cometan los golfos invasores,1
d_160_01,"A lo mejor hay que empezar a tomar medidas contra determinados imanes salafistas antes, y no despues, de que esparzan su veneno.",1
d_1610_02,"Vigila tu piel, no saques nada de estas basuras.",1
d_1611_02,Una cosa es estar en contra de la inmigración ilegal y otra ser racista.,1
d_1615_01,Puedes ayudar pero no olvides que te están invadiendo.,1
d_1617_01,"Ya no es solo porque la voluntaria se deja abrazar en pandemia por un asaltante, es que la C.Roja ha perdido el oremus.",1
d_1617_02,"En las Islas Canarias van de fiesta con los invasores, eso es seguro.",1
d_1628_02,Si procrean es para dominar el mundo.,1
d_162_04,"No, en absoluto, mientras nuestra cultura sea respetada.",1
d_162_05,¿Por qué lo digo? Porque las mezquitas no son utilizadas para la 'comunicación' con Dios sino para la transmisión de consignas radicales y fundamentalistas que abocan a muchos al terrorismo.,1
d_1630_01,No se equivoque una cosa es atender a quien te invade y otra ofercerle lo que no se da a los españoles que necesitan.,1
d_1635_01,"Que se les atienda no quier decir que olvidemos que estan invadiendo un terreno, tampoco que les tenagmso que regalar lo que a gente de aquí le falta.",1
d_1635_04,"De todos modos estos que defienden incluso para invadirnos, para empezar poniendo uno en su casa.",1
d_1639_01,"Huir de la miseria y la desesperación es normal, incluso te lo harías a ti mismo si estuvieras en su situación.",1
d_1642_01,Responder a un abrazo angustiado de los que vienen del juego es casi un imperativo moral.,1
d_1642_02,"Sólo poniendo un segundo en la piel de esos ""invasores"", este tipo de comentarios picarían en la lengua.",1
d_1649_01,"Según los medios marroquíes, esta debe ser la brutalidad con la que tratamos a los inmigrantes.",1
d_164_01,¿Podemos mencionar la relación entre los ataques terroristas y el Islam?,1
d_1654_01,"Pero bueno, a unos los envían con mentiras o falsas expectativas (¡como si esto fuera Jauja!), o simplemente como sicarios del régimen alauita, y a esta chica no se le ocurre criticar lo más evidente:",1
d_1656_02,Basta de tonterías con los africanos.,1
d_1658_02,"Preséntale a su esposa e hijas, y yo pondré la mía en buen estado de salud.",1
d_1666_02,"Podremos ser muy buenos, pero traerlos aquí no es ninguna solución, sólo empeora la situación para los que vivimos aquí.",1
d_1669_01,Le estaba diciendo... que no te preocupes porque no te damos un piso de protección oficial y te enchufamos en el sueldo del IMV a expensas de esos estúpidos españoles que trabajan para ti.,1
d_1670_02,ONGs en Twitter difundiendo...inmigrantes pobres...niños pobres...,1
d_1674_01,La culpa de esta situación se decreta como los responsables de acoger a los invasores en las Islas Canarias.,1
d_1674_02,"Ellos dan la imagen que dan, y luego aquellos que vienen esperan encontrar la misma.",1
d_1674_03,"Hotel, piscina y chicas calientes lanzando vivas a Marruecos.",1
d_1683_02,Cuantas mujeres están violando esta gente en Canarias.,1
d_1684_02,"Los ceutis ,los vecinos y habitantes de Ceuta, que se encontraron invadidos por 10.000 Inmigrantes y Todo lo que conllevó dicha invasión y las consecuencias siempre las sufre y paga el pueblo",1
d_1694_01,"Que escriba 3000 veces ""a los migrantes, besos y abrazos no"" para ver si lo aprende.",1
d_1696_01,"El Ejido, Almería, hace algunos años. La población salió a las calles ante las continuas tropelías cometidas por magrebies.",1
d_1696_05,En una palabra: impunidad.,1
d_1698_01,"Barcelona, Plaza Real, literalmente tomada por las menas, que te roban poniéndote un cuchillo en el cuello si te resistes.",1
d_1698_03,Usted reporta cientos a la Policía Nacional.,1
d_1700_01,"Ellos tienen salarios generosos, necesidades básicas cubiertas, y sin embargo roban para el placer de robar y hacer sufrir y porque trabajan para mafias que distribuyen bienes robados en sus países de origen.",1
d_1700_02,"Entonces las monjas ""progresistas"" que cometen crímenes debido a la pobreza, la desigualdad, la necesidad y todos los amamantados en su repertorio de consignas, son MENIRA.",1
d_1701_01,"Se prevé que Europa cuente con 75 millones de musulmanes en 2050, con lo que caminaría hacia EURABIA.",1
d_1703_02,¿Sería porque los autores eran un grupo de marroquíes?,1
d_1704_02,"La vergüenza es no poder localizar a la chica ""vinculada"" que recibiría a los de esa manada en su día, para agradecerle por su ""humanismo"".",1
d_170_06,"El universo mesquitero está creciendo como luna primaveral a través de las tierras catalanas entre diversas corrientes con preeminencia marroquí, ocultas bajo el control irónico del gobierno de Mohamed VI con sus imanes como cinturón de transmisión.",1
d_1712_01,"En vista de lo que ha sido una invasión organizada por Marruecos, violando la soberanía de España, o al menos esto es lo que muchos consideran, ver esta imagen de acogerlos con los brazos abiertos, como huyendo de una guerra o similar, que acaba de salvar sus vidas, es lógicamente crítica.",1
d_1721_06,"No aquí, porque en España los criminales, los ilegales y las turbas tienen más derechos que los propios españoles.",1
d_1730_01,Van a venir a España hasta de Marte.,1
d_1731_02,"Como literalmente, van a venir a España, incluso desde Marte.",1
d_1732_01,¡¡¡Invasión marroquí!!!,1
d_173_01,"No queremos imanes salafistas a sueldo de Arabia Saudi, que solo sirven para lanzar a la gente al terror.",1
d_1742_02,"Nos echan, nos saquean, nos roban e instalan a los que llegan y bien alimentados, protegidos e informados y fortalecidos con todo tipo de BENEFICIOS y DERECHOS.",1
d_1745_01,"Ayer en un hospital de Murcia un sujeto que no sabia ni hablar una palabra de español , dándole un tratamiento de no se que en la misma sala que me atendían a mi , esto es un cachondeo , en Murcia ya hay mas moros que en marruecos y siguen entrando",1
d_1746_01,un desastre total y ahora los argelinos ven el collo y llegan a miles,1
d_1755_04,Cazados todos estos ilegales y devueltos a su País.,1
d_1756_01,"Cómo estará España, que cuatro muertos de hambre consiguen invadirla.",1
d_1757_01,Armengol ya ha dicho que hay que encontrar a los moros para darles una casa y una página.,1
d_1759_01,"Durante el año pasado, una pandemia que causó la muerte de 74.000 españoles no fue motivo suficiente para que este gobierno pusiera las razones de salud pública ante las de los supuestos derechos humanos de más de 41.000 inmigrantes marroquíes y subsaharianos...",1
d_1759_02,"Se colaron en España en pateadores y el gobierno no reaccionó, simplemente se tragó.",1
d_1759_04,"Poniendo en riesgo la salud pública por aparecer, como el gobierno más bueno del planeta, creo que da una idea de hasta qué punto están dispuestos a tolerar esta invasión pacífica que, hoy, sin tanto riesgo de la pandemia, continúa sin que se vea ninguna intención de cambiar.",1
d_175_04,Es increíble que jamás se haya establecido ningún control sobre los ulemas de mierda salafistas que vierten su veneno desde los púlpitos de las mezquitas... parece como si ésto fuera parte de un plan.,1
d_1762_01,"Estoy absolutamente desilusionado. Creo que el ""partido de la democracia"" (profundización de la economía, violaciones masivas, no poder hablar español, república islámica...) durará mucho tiempo, porque la mordaza siempre votará por ellos.",1
d_1763_01,"Sólo espero que las personas, que ven este tipo de programas, como los de la mentalidad ideológica de Izda, tengan un toque completo sobre ellos y lo que consideran suyo, se desvanezcan, toquen sus bolsillos, cómo España está llena de refugiados e ilegales, y menas, la UE exigirá nuestras cuentas, mientras que el dinero de Lad ayuda a que el dinero de la UE se agote y nuestras nueces se aprieten, las ideologías se acabarán.",1
d_1765_01,"Supongo que esos inmigrantes no deseados todavía están en algún lugar del aeropuerto, los buscan y los encuentran, los vuelven a subir al avión y los envían de camino a Turquía.",1
d_1766_01,"Ahora ya no vienen en pateadores, ahora en avión.",1
d_1767_06,"Pero claro, es que yo soy español y ya se sabe.",1
d_1774_01,Marruecos y los moros - el nombre es correcto - debe ser detenido con el único lenguaje que entienden: la fuerza.,1
d_177_03,La serpiente ha mordido al que la protegió.,1
d_1783_01,"A esto se le llama subvenciones efecto llamada, pero si es que es normal que hagan estas cosas, aquí les damos dinero, alojamiento, comida, y la posibilidad de delinquir sin consecuencias, sin contar que pueden violar, y que si les pillan no les cortan la mano y a ella la lapidan por dejarse violar, es normal que quieran venir como sea.",1
d_1784_01,La invasión marroquí en España no terminará hasta que haya deportaciones inmediatas.,1
d_1784_02,"Los canarios están invadidos, hay miles de marroquíes,",1
d_1784_03,"¿por que el Gobierno no los devuelve a sus tierras, pretenden dejarnos en manos de Marruecos?",1
d_1785_01,¿Y ahora los van a devolver a Marruecos o los van a enviar a las Islas Canarias con los otros indocumentados que tenemos aquí?,1
d_1786_01,"Porque ellos los enviarán aquí, que son como reyes que viven en el cuento y en otras cosas.",1
d_1787_01,"Los que entran en España de esta manera, o como sucedió hace unos meses, que han sido derribados como ganado por el rey Marroquí satrap, independientemente de su nacionalidad de origen, deben ser expulsados inmediatamente, pero los que lo han hecho cometiendo un delito como el del aeropuerto, primero deben ser castigados penalmente antes de repatriarlos.",1
d_1788_03,Tienen que quedarse allí.,1
d_1797_01,"Hay que encontralos ya para poder darles una vivienda, manutención, una paga que complemente los robos que hagan y avisarles de que si cometen delitos, da igual del tipo que sean, pasarán un par de horas en comisaría",1
d_1798_02,"A lo largo de los años nos habíamos acostumbrado a la inmigración ilegal, en la que la gente usaba diferentes medios para entrar en nuestro país.",1
d_1798_05,Es evidente que ha nacido un nuevo procedimiento ilegal. Inmigración VIP.,1
d_179_01,"eso de la impericia me parece alucinante, y espero que sea eso y no la cutrez nacionalista, porque encontrarse una casa derruida, con ""okupas"" marroquíes, en un sitio apartado de todo...",1
d_1804_02,"Aquéllos no nos costaban nada, los de ahora nos los endosan a nuestro cargo.",1
d_1809_01,Dicen que hay todos los aeropuertos de Marruecos con moros alineados.,1
d_1810_02,Que se queden violando al sur del estrecho.,1
d_1811_02,Ahora para infectar a los españoles...,1
d_181_02,No queremos esa gente aquí.,1
