id,text,stereotype_a1
s_1669,A su país a pelearse con los chamanes!,1
s_2014,¿Cuentan los MENAS paniaguados?,0
s_1141,Ininteligible para ignorantes y racistas como el dicente.,0
s_1097,"Todos los cojones que no tenía para echarle aL dictador de turno en su país va a venir a echarlos aquí, vete a tu puto país a gritarle a esos, COBARDE!",1
s_3395,"El pacto habla, entre otras cosas, de invertir en esos países para que se desarrollen y así disminuir la inmigración ilegal
URL",0
s_539,"Antoni Camps, es que ahora queda muy bien para que no te llamen xenófobo, ir de buenísimos por la vida... Hay mucha hipocresía...",0
s_2225,Pagas más luz y el diesel o la gasolina están carisimos. En qué ayudan exactamente. No puedes vivir ni teniendo trabajo.,0
s_3318,"Dale Santiago,hay quedarle un parao a esos vividores del estado,recuerda que contigo están Matteo salvini de Italia,le pen de Francia,hoke de Alemania,y por aquí en Sudamérica Bolsonaro de Brasil,Franceschi de Venezuela y triump de EEUU",0
s_2752,"¿Con que sistema laboral? Empleo temporal y falsos ERES. ¿Con que reforma? La herencia deja menos parados.
O el ya famoso y como la cosa funciona a ver qué inventamos para joderlo.",0
s_2828,"Exactamente, justo en esos puestos publicos es donde quiero recortar porque  los 3 millones aprox de puestos publicos son bomberos, policias y sanitarios.",0
s_1836,"Excelente noticia para todos. Labor d la sociedad en su conjunto, con los trabajadores, empresas y administraciones públicas, fundamentalmente el Gobierno progresista y la vicepresidencia q gestionas. La nueva reforma laboral tiene que poner las bases para consolidar estos datos.",0
s_19,Este gobierno está empezando a darme mucho asco.,0
s_1940,"Vara* de medir, que no sabes ni escribir, estás como para dar lecciones",0
s_1416,"Si tan mal se encuentra aquí,  por que no se marcha a otro sitio? Igual sería más feliz",1
s_3270,"Alguien en Europa ha decidido que la mejor manera de competir contra la economía china es importando mano de obra barata, aún a costa de sacrificar el estado de bienestar de la clase trabajadora. Sorprendentemente la izquierda aplaude está iniciativa de las grandes empresas.",0
s_914,Que se vaya a su país si no le gusta nuestra cultura,1
s_858,"Lo más wapo el vídeo que el subnormal que va de guay,le pregunte al chico inmigrante que lo que el está haciendo es ilegal, a caso vox es legal??😂😂😂😂a casa PP s legal?? Porque si nos metemos de lleno sacamos mierda para regalar.",0
s_472,"No

Los Refugiados tienen un Estatuto especial, pero para tenerlo deben ser reconocidos, acreditandolo adecuadamente",0
s_2414,"¿Has visto el perfil de candidatos a los que va a dar empleo?
Tela!
URL",0
s_3317,Occidente está en peligro y los progues o no se dan cuenta o no les importa,0
s_4152,Lo peor es que hay gente que se cree lo que dice este personaje a diario.,0
s_3282,"Esto de ser tan catastrófista de donde viene? Pero si la gente se está yendo de España! Que no se quedan ni los españoles. Que no hay trabajo! Que los corruptos son un problema real, no la inmigración que ha disminuído con los años y ha aumentado la emigración",0
s_1688,"Acaba de fallecer el joven canario agredido por un inmigrante ilegal en la plaza del hierro de MASPALOMAS
Descanse en paz.
A ESTO QUE DICE EL GOBIERNO SOCIAL COMUNISTA.
¿ESTO ES LO QUE NOS HA TRAÍDO?
NI CANARIAS NI ESPAÑA NOS MERECEMOS ESTO.",1
s_2402,"Se te ha olvidado decir que ahora hay casi 2.000.000 de personas más en España.
Mentís más que habláis.",0
s_1565,"El que no esté contento con las tradiciones nuestras,que coja el camino de regreso y reivendique en su país,que nadie le obligó a venir aquí",1
s_686,"Mientras se congelan las pensiones... Alucinante que los españoles tengamos que pagar con nuestros impuestos la compra de tabaco para los inmigrantes del CETI de Ceuta 😡😡😡, ¿alguien sabe a qué se refiere ""productos afines""?, ¿les estamos pagando otro tipo de vicios? URL",1
s_2314,"74% en contrato temporal, mas de 300.000 gracias al turismo, cuando acabe la temporada a la calle ¿ de que presumen?",0
s_3547,"Pues si, @user va a pasar a la Historia de España, vendrá incluso en los libros de texto, pero como el traidor más grande que ha conocido nuestro País, ese que dejará hecho unos zorros",0
s_3970,Te sugiero que veas las estadisticas de violacion y maltrato en españa en cuanto a españoles e inmigrantes no pienso debatir sobre algo tan sensible y visto lo que me has respondido ya se que eres de Vox asi q paso de hablar con escorias,0
s_2169,Lo tiene todo 😂😂😂 y encima querrá paguita 😂😂🤭🤭,0
s_1806,Gracias Yolanda por todo tu trabajo y esfuerzo... Serás una gran presidenta de esta nación. URL,0
s_1001,Lo más sensato sería pedir que acabarán con el democráticamente hablando.,0
s_2963,"Es inútil, no quieren ver o no les interesa URL",0
s_2516,"No, no me puedo hacer funcionario, cuando creo que sobran muchos de ellos.
Es un mero ejemplo, tambien te puedo dar otro ejemplo, un amigo mio, funcionario en un departamento de 5 personas, para hacer el trabajo de 1.",0
s_877,El día que descubras la diferencia entre inmigrante ILEGAL e Inmigrante LEGAL te daremos un cacahuete.,1
s_3879,"Sobre los Españoles:
- Están mirando el reloj en el trabajo, deseando que llegue la hora de irse
- Los españoles prefieren cobrar prestaciones en vez de trabajar
- El trabajo que no quieren hacer los españoles lo hacen los extranjeros
#MentirasPobreza",0
s_920,Los delirios de Cumbayá… 😂😂😂,0
s_1278,"Cuando el diablo no tiene qué hacer, con el rabo mata moscas",0
s_1212,"Ahora ya está hasta en la asamblea de Madrid pero eh, se ve que lo de traerse a la mujer e hijos abandonados en su país no se le va ocurriendo...",0
s_3470,Cuánto pecado en tan pocas palabras.,0
s_3062,"Hartito de los comentarios ""el que no es liberal es un ignorante"".
¿Qué se han creído?
Se pusieron cachondos/as oyendo dos conferencias de Steve Jobs en youtube...y ya estaría.",0
s_1700,"Los alumnos no están en el recreo.
Ejemplo de un centro ¿educativo? de la región catalana para los emigrantes menores de edad, que entran ilegalmente en España.
#Y_así. URL",1
s_1692,"Hola, por favor, me puedes decir quien te mando el video, gracias",0
s_2627,Pues reforma lo que tienes en mente y verás como vuelve a subir el paro,0
s_3678,"España es el ÚNICO PAÍS EUROPEO que firmará el Pacto para la Inmigración. En España casi no se habla del Pacto para la Inmigración que España firmará el 11/12/2018 en Marrakech, y en el que se compromete a aceptar y mantener a todos los inmigrantes ilegales que entren en el país.",0
s_2273,"La izmierda JAMÁS creará riqueza, porque sus votantes mediocres suelen irles mal y culpan a otros de sus fracasos. Buscan a un gobierno que robe al que se esfuerza para que les de limosna. Son parásitos. Jamás crearán nada, porque solo son destructores y envidiosos. BASURA",0
s_2494,Lo mejor que puedes hacer.  Yo primero les envío saludos 🤭 y luego block.,0
s_2383,Recuerdas cuando en medio de la crisis del ébola la izquierda saco a la gente a la calle por un perro? Recuerdas cuando subió la luz con Rajoy y la izquierda saco a la gente a la calle una vez más?  Piensa un poco antes de hablar de palos y piedras en el camino anda,0
s_2834,URL ocupados menos en la construcción... Tu eres tonto,0
s_1281,Y el Ramadán y otras celebraciones si son democráticas? Dejad en paz a la gente y que celebre lo que quieran.,1
s_1242,"Es tan sencillo como, el llega a un país y debe de adaptarse a lo que se encuentra. España es un país con sus tradiciones y deben ser respetadas. En consecuencia ¿Quiere que nosotros respetamos las suyas? Predica con el ejemplo. Respeto de un solo sentido, no.",1
s_4147,Alpiste inventando pa variar,0
s_3921,"Qué maravilla es vox. Qué poco acostumbrados estabáis a escuchar estas cosas. Sí, el 69% de las violaciones en manada son cometidas por inmigrantes",1
s_3932,"Pues tu misma te has contra decido antes asegurando que el 69% de inmigrantes son violadores.... Y el mismo PDF dice que el grupo mas alto por nacionalidad son Españoles! En fin, ya me canse de hablar de cosas sin sentido. Venga que te vaya bien y no manipules tanto!",0
s_2377,Menudos GÜEVAZOS .,0
s_3411,Espero que lo paguen caro en las urnas.,0
s_3744,"El de la katana de mató a los padres era español de pura cepa. El Bretón también, el de la Baraja...podría seguir pero no tiene sentido 🤦🏾‍♂️ de verdad",0
s_3506,Pero vamos a ver que el pacto habla de reducir la inmigración ilegal que no puedes debatirme eso que es que es literalmente lo que pone y además explica cómo se va a hacer que no hay debate posible,0
s_3742,"dais más importancia a la nacionalidad de quien lo hace que al asunto en sí, que tristes sois colega",0
s_2575,Hay 270.000 empleados públicos más y 312.000 empleados privados menos. El sector privado paga los gastos del público. Saca las conclusiones que quieras. URL,0
s_3687,Con lo cual tenemos que solo el 15% de los habitantes de Navarra comete el 27% de los delitos. A lo que habría que añadir que hay mucho migrante que tiene nacionalidad española. Por tanto no va desencaminado el alcalde,1
s_874,Tómate tu Frankipastilla.,0
s_1686,"🔸El joven canario agredido por un inmigrante ilegal en la Plaza Del Hierro de San Fernando de Maspalomas ha muerto esta tarde en el Hospital Insular.
Vaya mierda de GOBIERNO tenemos!!!!

#PlazaDelHierro #GranCanaria",1
s_2351,"Pero en INVERSIÓN PRODUCTIVA!! No en el gobierno más caro de la democracia, o en ministerios de 500 millones de euros para promover estudios de autopistas binarias. Dilapidar el dinero.como los planes E de ZP. Luego una suoercrisis, pueblos con piscinas climatizadas arruinados.",0
s_2504,"Lo que vendría a confirmar que ustedes quieren derogar la reforma laboral del PP porque, como buenos comunistas que son, disfrutan destruyendo todo aquello que funciona razonablemente bien.",0
s_1031,Menudo Gilipollas¡¡¡... no tenia donde caerse muerto y esta en la Asamblea de Madrid cobrando un pastizal¡¡¡¡,1
s_326,Lo que no pasa en ningún otro país,0
s_3061,"Pues genera PIB, mantiene  45.000 familias y aumenta el consumo privado. No está tan mal",0
s_926,Prefiero acabar con el topmanta por ser competencia desleal y delictiva! Y a quien la práctica de vuelta a su país y eso te incluye a ti,1
s_1566,Por qué es racista la Cabalgata???,0
s_3653,"Perdona España no es el único país de la UE que firmó eso , todos los países de la UE firmaron excepto , Italia Hungría , Polonia y un par de países más creo . Un saludo :)",0
s_4020,"2.13 EFICACIA
""Tengo dudas, no se si el sobre precio se debe a la ineptitud o a las comisiones.""
----
Carrefour las vende a 0,6€ iva incluído,Portugal a 0,25€ y el ministro socialista Salvador Illa ha comprado 460 millones de mascarillas a 0,75€ sin iva
URL",0
s_1104,"Pero si hay uno negro, uno musulmán y uno blanco!!!
Me juego lo que quieras a que si fueran los 3 blancos protestarian también.",0
s_4221,Que sigan votando PSOE,0
s_3043,😂😂🤣🤣 vi esa foto estan las 3¡,0
s_309,"Si pero no se les ha puesto en bandeja, ni se les a invitado a venir diciendoles q tendran sanidad gratis y una paga??? Pero q cojones me cuenta??? El dinero no es suyo, es de todos los españoles y aqui hay muchos q necesitarian ayuda y no digo q se no se ayude a nadie ojo! Pero.",1
s_3368,Estamos en guerra: civilización frente a globalismo. Y no podemos perder.,0
s_2013,¿Ya no te gusto? URL,0
s_2509,"Sois mentirosos, psicópatas, y sobre todo caraduras, ladrones, golfos y unos putos golfos",0
s_4266,"Canarias pidiendo auxilio, Canarias ya está ocupada por marroquíes y mauritanos, ya son más que la población, la vida es imposible, es una toma pacífica del territorio, empezando a pedir derechos, la población empezando a tener miedo ++++
El gobierno español vende E a Marruecos",1
s_1294,¿Y no sería mejor que esa rata se fuera a su pais?,1
s_3933,"No hijo, que no te enteras. El 69% de las violaciones en manada, no el total. Ese PDF dice que la mayoría de las violaciones en manada son cometidas por extranjeros. Mezclas churras con merinas.",1
s_2400,"Me podías decir esos funcionarios no consumen servicios y productos del sector privado, de quién cojones cobrabas. Que para tu información , esos trabajadores públicos hacen el trabajo más barato que el sector privado. No reparten dividendos",0
s_3505,"Vuestra prosperidad.
Que una mamandurria de 83.000€ no la tenemos todos...",0
s_4037,"19.33 CATALUÑA menas
"" A ver si ,ademas, estan haciendo caja.""
-----------
Una alcaldesa de #ERC factura 8.000 euros al día por alojar a MENAs

El negoci que tienen montado algunos políticos con el #VolemAcollir.
Esto no lo verás en TV3.
(@user)
URL",1
s_2185,al menos son buenas noticias y menos quejarse carajo,0
s_362,"Alguien tiene que pagar su ""jet"" privado.
Sus viajes.
Los subsidios a inmigrantes ilegales.
La Sanidad de ""barra libre""...
Etc..... URL",1
s_4257,"viene turismo y no se puede ya vivir. Una barbaridad . Han robado en una iglesia. Tienen dinero móviles y encima están viviendo en hoteles.

Los canarios  piden auxilio porque los demás medios de comunicación no estan hablando de ello.

Desde Canarias están pidiendo auxilio. Hay",0
s_1346,Viva Los Reyes Magos URL,0
s_3190,Al menos no se fueron de putas y se lo gastaron en coca como los del PSOE,0
s_1980,"Se trata de sustituir empleos de la economía privada por empleos públicos.
La deuda no la podréis seguir incrementando indefinidamente y cuando corten el grifo, todo se desmoronará como un castillo de naipes.",0
s_2401,"...Y los recorte de los servicios públicos... Fíjate que con un poco de suerte, cuando vuelva a gobernar el PP, los de la Marea Blanca se acuerdan de pedir que en tu pueblo, Alfaro, vuelva a haber al menos un pediatra!!🤞",0
s_2914,"Quiero pruebas decir cosas y correr bulos es muy fácil, cuando se dice una barbaridad así hay que demostrarla",0
s_4256,"Lanzarote, el número de marroquíes ya es mayor que el de la  población autóctona. Es una estrategia marroquí que empieza a darle resultados: la toma 'pacífica'  de territorios  mediante su ocupación por las bravas. Igual que en el siglo VIII. Se entiende como 'toma",1
s_713,"Muchas gracias, @user , yo sí que estoy agradecido de pertenecer a un partido en el que militan tantas personas valientes, como tú mismo. Seguiremos trabajando sin descanso desde el @user para acabar con esta pestilencia virica del #coronavirus de Wuhan. URL",0
s_2101,Si si lo que tú digas pero 20 M de ocupados señoro.,0
s_677,"Hombre contando que existen unos derechos humanos universales, pues si es malo muy malo. Toma a ver si con esto lo entiendes o tampoco URL",0
s_1203,"Yo te doy otra opción. Si no te gustan nuestras tradiciones,  te piras a tu país.",1
s_4115,"5.75 INMIGRACION
""Estos actos intimidatorios contra la poblacion son exponencialmente perversos por q afectan a sus capas mas vulnerables.""
-----------------
Tremendo placaje de un policía en Ceuta para detener a un inmigrante q amenazaba con un machete.
URL",1
s_3459,"Pero si el que ha estado viviendo de la paguita del Estado toda la vida eres tú, sinvergüenza. Los inmigrantes vienen aquí a trabajar y a dejarse el lomo, no como tú, ahijado de Esperanza Aguirre, la que vivía rodeada de corruptos.",0
s_5,"Entonces le vamos a pagar la sanidad a los inmigrantes legales e ilegales. No sólo colapsan urgencias, si no que los inmigrantes de clase alta vienen a operarse gratis. Venga gracias por joder el país un poco más @user URL",1
s_272,"Es desesperante, gente que no trabaja y sanidad gratis, pisos, colegios gratis, dentista gratiss y una paga que hay españoles que han cotizado y no tienen paga. Esto clama al cielo. Y encima se sacan una prohibición de no dar agua al Levante, esto que es??....",1
s_3134,"YAQUE ESTAIS CON LO DE FRANCO , ESTAIS SEGURO QUE FRANCO ESTABA EN EL VALLE DE LOS CAIDOS, CUANDO ACABAN DE DECIR QUE LA FAMILIA DEL DOBLE DE FRANCO PIDEN QUE SE AVERIGUE SI ES SU FAMILIAR",0
s_1988,"Estos datos no hablan en absoluto de una recuperación Justa, al menos no se puede concluir eso con la información que dan. Y ella es la primera interesada en tener eso claro si pretende continuar adelante con la derogación de la reforma laboral. Datos y mensaje incoherentes.",0
s_2886,Gracias a su gestión la gente está en erte con obligación de volver a la empresa y no en paro. Te recuerdo que estamos así por el covid. Así que deja de mentir. Gracias a su gestión estamos en unas cifras de paro aceptables a pesar de la pandemia. Y mejorará.,0
s_3221,"Soy liberal pero no anarcocapitalista creo en un estado de bienestar y equidad, eso sí no creo en la igualdad ni en la mal llamada discriminación positiva. Un cajero tiene mucho mérito pero el inventor de la pilicilina mas, aunque los dos se merecen el mismo respeto.",0
s_1771,"Los ERTES no se contabilizan como desempleo, como no puede ser de otra manera; y como en todo texto hay cosas buenas y otras pesimas, se cambian las pesimas",0
s_1620,Me encanta leer a los trogloditas que se creen este bulo 🤣🤣,0
s_1407,Eso es que siempre le traen carbón u está resentido,0
s_1277,"Serigne, te puedes ir de una patada en culo a la mierda y a tu pais de mayoria musulmana y asi no tendra que ver como seguira celebrando la festividad de los Reyes Mago, mantero de porqueria.",1
s_3198,"Supongo que aunque sea otro periódico, no será mentira la noticia no? 🤣🤣🤣🤣🤣",0
s_520,"Pero que santo morro tienes Sebastián, si casi todo tu hilo es falso o incorrecto.",0
s_3465,"Según se indica en el documento, el Pacto Mundial presenta un marco de cooperación no vinculante jurídicamente –  es decir, no obliga a los países que lo firman – pero conociendo a ""J.F.Sánchez"" es para echarse a temblar.  Hablan de 150 países. El País dice 165. A saber cuantos.",0
s_3620,"El OCUPA odia a España, esta claro, es peor que Torras.",0
s_1830,"Profundo agradecimiento de todas las chonis y charos. De todas las inútiles, gracias a la más inútil de nosotras. Nos representas divinamente. 😡😡😡",0
s_3841,"🔴 Si ya has residido en España los años que te corresponden de forma legal y continuada, solicita ya la nacionalidad española por residencia.

👩‍⚖ Solicita cita con nuestros expertos extranjeristas: URL

#Abogados #Extranjería #ExtranjeríaMadrid URL",0
s_2940,"Pues que eso no es crear empleo es aumentar la ya de por si sobredimensionada administración pública. Y así se enmascara la realidad.

URL",0
s_837,"Exacto

El que se posiciona en tuitter servil con los ricos de las  mafias exploradores de los inmigrantes ilegales y se ensaña con los pobres autónomos propietarios de tiendas legales que se arruinan pagando impuestos, tasas, alquileres, IAE, seguros y sufren competencia desleal",1
s_1827,"¿?.. 😂 Es falacia porque lo dices como algo malo cuando no lo es necesariamente.
Lo que está claro es tu visión sesgada por el sectarismo político acerca de la gestión de este ministerio.",0
s_211,"¿Necesitas una respuesta ? Seguro que adivinamos ... ¿los ciudadanos? No, si es que se nota que tengo estudios ...",0
s_1537,Pues se queda sin curro tu amigo baltasar nose tu @user,0
s_1222,"Yo pido acabar con los diputados enchufados que solo hacen perder el tiempo, quedarse con nuestro dinero y decir muchas muchas muchas gilipolleces",0
s_3310,Elecciones ya para retomar el control de nuestro  país  y de nuestras fronteras!,0
s_3211,"Cometes un error gordísimo perdona
Las ideologías son ideologías escriba quien las escriba con el interés que sea o el que coja unos textos, como los de Marx, y monte una ideología.

Porque ninguna afronta todos los aspectos de la existencia
Ninguna da solución...",0
s_1538,Es un país democrático no te hubieran regalado la nacionalidad…,1
s_582,"Como empiecen a sacar cargos de ese tipo estamos apañaos. La lista sería larga, me temo.",0
s_3722,"El PSOE, un partido de izquierdas.
🤣🤣
Aquí las CIES a pleno rendimiento, los menores migrantes tutelados por el Estado en el punto de mira social aún siendo niños, devoluciones en caliente todos los días.. y encima vosotros esparciendo racismo y xenofobia.
Que cuajo!",0
s_315,Debería dar las becas a los inmigrantes ilegales que son los más desfavorecidos y así vendrán más y podremos acogerlos y mejorar sus vidas,1
s_2444,"Esta gente está manipulada y ciega, por el engaño de las derechas.",0
s_1038,"El que no tiene cabida en España es éste pedazo de cbron que entró ilegal y jode al comerciante honesto
Patada en el cvlo y devuelta a su País",1
s_423,"Punto 17. ""Acabar con el efecto llamada: cualquier inmigrante que haya entrado ilegalmente en  España  estará  incapacitado,  de  por  vida,  a  legalizar  su  situación  y  por  lo  tanto a recibir cualquier tipo de ayuda de la administración"".",0
s_1030,"Alguien acomodado en un país que no es el suyo, ennqle que se le ha dado de todo, hablando de racismo.
El chiste se cuenta solo.",1
s_3010,"No será por la reforma de Rajoy. Además de los despidos por enfermedad, el ministerio debería haber prohibido los ERES en empresas CON BENEFICIOS ,como la CAIXA. ¿Por qué no se ha hecho ya? ¿Y por qué les salen rentables los ERES fiscalmente a empresas?",0
s_2181,"No sabía que ella creaba puestos de trabajo, siempre he pensado que eran los malvados empresarios!!!!",0
s_3599,"A ver. Los inmigrantes van a venir igual, el tratado garantiza que vengan legales y con derechos pero claro, es que lo que quereis es que vengan ilegales para cuando los contrateis hacerlo en negro. Siempre defraudando al estado los señoritos.Ser tb patriotas para pagar impuestos",1
s_1553,"Tampoco deberían tener cabida los que venden productos falsificados, sin garantía, sin factura, sin I.V.A., ocupando un espacio público sin autorización ni pago de tasas por su uso, etc...",1
s_2337,Definitivamente eres un manipulador mentiroso. EL 99% DE LA EMISIÓN DE DEUDA LA COMPRA EL BCE POR ORDEN DE BRUSELAS. Si se cierra el grifo España quiebra en 3 meses. Defualt y luego bajada inmediata de pensionws y salarios públicos del 40% estais minitiendo y lo sabeis,0
s_1150,puedes irte a tu país si no te gustan las tradiciones cristianas.... se trata de racismo solo en tu cabeza y en la de tus jefes que te piden decir chorradas para crear cortinas de humo.,1
s_1070,Joder con el conguito !!😡😡😡,1
s_1019,"En un país democrático y normal, este tipo de personas estarían en la cola del paro por no tener ningún tipo de cualificación profesional",1
s_2564,"Que tienes 15 años? A parte de faltona cortita. Típica votante de este Gobierno. Solo espero que lo estes disfrutando y te animo a que pidas la paga a la dependencia, das el perfil!",0
s_4230,Voten por un gobierno que los recojan a todos y devuelta a sus paises de origen. Y guardia costera para evitar que sigan entrando ilegalmente.,1
s_876,"Macarena Olona, de Vox, crítica que los inmigrantes puedan “caminar tranquilamente por las calles"".  Está claro: desde su punto de vista, ¿dónde pueden estar mejor que en los campos de concentración? Qué cosas tiene la democracia, oye.",0
s_2040,"Se lo decía a Paul el iluminado, el país va para arriba, es evidente",0
s_2412,"Por no hablar de los GAL. Si vives desinformado luego cometes estos deslices, el PSOE tiene todo tipo de delitos y los que van a salir.",0
s_3213,"Exacto cada persona tiene un enfoque, como las ideologías y es difícil URL final nada es blanco ni negro y una socialdemocracia como la sueca da unos niveles de bienestar y libertad económica muy alto, con sueldos altos y empresas punteras.",0
s_4000,"2.3 EFICACIA
""Montan un asentamiento de inmigrantes ilegales en Albacete y lo gestionan como ellos saben"".
-----------------
Comunicado de un restaurante de Albacete sobre la protesta de los inmigrantes del asentamiento ilegal de Albacete.(@user)

 URL",1
s_2375,"Esos datos son mentira.
El turismo a un 50% desde 2019 dónde están todos esos trabajadores?
Y los ERTE, no se cuentan? Son 300.000 almas y subiendo. URL",0
s_3094,"Que pena que a ti no te haga nadie ni puto caso. Es curioso, para una sola persona que nos lee y ha coincidido plenamente conmigo en lo coñazo que eres y el poco cerebro que tienes",0
s_3122,Es increible... le preguntas que pasa si gastas más que ingresas. y un terraplanista izmierdoso te dice.. pues gastar más y pedir prestado y se queda tan ancho y así hasta que alguien pague la fiesta.. lo que el tonto no sabe es que la pagará el.. con trabajos precarios y miseria,0
s_1234,"Eso terminemos con todo, los únicos valores y tradiciones son las que vosotros digais, estos mucho peor que una dictadura. Que ganas de que haya elecciones para mandaros junto a vuestros compañeros de Galicia.",0
s_3553,Los inmigrantes utilizan España de paso.Una mínima parte de queda aquí.Van hacia Europa.Pero Vox utiliza eso para enfrentar a la gente.,1
s_2371,"Efectivamente, ese es el problema, las derechas lo que quieren es lo de siempre, quitar derechos a los trabajadores.
Si hay alguien como @user que defiende y lucha por esos derechos, les estorba.",0
s_1065,Si no te gusta León ahí tienes la estación,1
s_966,Vaya chollo tienes!!! Ilustrado!!!,0
s_4021,"5.9 INMIGRACION
Ultimas 48 horas:

Más de
*20 pateras llegan a Almería.
*2 llegan a Alicante.
*3 a Canarias.
*4 a Baleares.
*2 Algeciras.
- 1 moto de agua a Granada (3 magrebíes).
- A sumar las no interceptadas.

⚠️ Más de 250 invasores, más de 20 contagiados.(2/8 ruben pulido)",1
s_3745,Ojalá las redes sociales estuviesen prohibidas para los subnormales que tú. Que pena que tengas mi mismo derecho a voto,0
s_732,"pagamos... si lo que habrá pagado Abascal, que no ha cotizado en su puta vida y si es trabajar ya ni cuento.",0
