id,text,stereotype_a1
s_3048,"Le voy a dar un dato, señora Díaz.
En Andalucía no baja el paro, SUBE. En 41.100 andaluces, concretamente. Un 4,74% más que el trimestre anterior, dejando una tasa de desempleo del 22,41%. Casi 8 puntos más que la media española y casi 11 respecto a comunidades como Madrid.",0
s_2790,🤦‍♂️🤦‍♂️Una vez más ¿Tú te lees los links que pones? En este sólo relatan la historia del partido NAZI en ningún momento entran a analizar su ideario y sus políticas.,0
s_385,"Defendiendo el dumping laboral, machote?
Los sueldos suben cuando la gente no se rebaja tanto. Al defender la inmigración ilegal defendéis destruir el poder de negociación del trabajador español.",0
s_1088,Esta rabioso porque no le han dado el papel de Baltasar.,0
s_3460,"Eso es el Concordato, no?",0
s_2201,"Por eso porque sabe lo que hay( por eso es tan cabezona con la reforma laboral) y por las distintas partidas del ministerio para empleo juvenil y no juvenil. Las cifras de paro y afiliación son brutales, pese ha que hay que seguir profundizando.",0
s_200,"Sí este despilfarro continúa, los cotizantes deberíamos organizar una plantada y dejar de pagar impuestos en bloque.
#PlantónDelContribuyente",0
s_3880,"Más sobre Género:
- Los hombres se pasan el fin de semana bebiendo cerveza y viendo el futbol
- Las víctimas de violencia de género son sumisas
- Las mujeres musulmanas son racistas
- Me llaman puta por ser mujer y extranjera
#MentirasPobreza",0
s_3605,Me encanta la ingenuidad d personas como usted. La pena es q gracias a pers. como usted el mundo civilizado se va al carajo.Que tenga buen día.Paso a dilenciarla. Más q nada porque me molesta perder el tiempo con personas tan naive (el cancer del buenismo mal entendido)como usted,0
s_3622,Sánchez obedece a Soros mucho antes de ser el okupa de Moncloa. Rajoy seguro que también pues no veo otra explicación a su errática y traidora política. Mucha atención a este problema debemos.,0
s_656,"Para ser de derechas has dicho el punto clave, SOLUCIONAR EL PROBLEMA EN EL LUGAR DE ORIGEN, pero mientras tanto, además, atendenderlos normalmente como a cualquier otro.",0
s_2592,¿Acaba de pasar usted un gráfico señalando las cifras más altas de paro con Rajoy y las más bajas con Zapatero? Jajajajajajajajaja. Menudo genio.,0
s_1869,"Esa noticia interesa y mucho.

Interesa tanto que es recomendable no quedarse con el titular y ver que empleo se ha creado y cual se ha destruido.",0
s_1812,Si todo va tan estupendamente bien...¿Por qué hay que derogar la reforma laboral?.,0
s_3057,"Mas o menos la misma formula 2008? que luego dejó una pobreza inmensa? el gasto social crea riqueza? no es mejor dar trabajo que ingreso minimo? debería ser trabajo mínimo vital, basta de ayudas, no las queremos hagan otra cosa porque ya sabemos el final de sus ""buenas noticias""",0
s_3217,"perdona que te use, es una condena socio-ideologica el decir ""soy ...""
Yo soy Luis y tú serás Pedrín

Tener que definir el ser
Por ateismo. Izquierdismo...
Es la gansada en la q nos quieren

Creo en Dios y pago yo las vidrieras de la catedral... No soy cristiano
¿Me expliqué?",0
s_3708,"-¿A ti te han hecho desnudarte en un país extranjero al que has sido lanzado de niño y te han mirado los genitales ?
¿Es normal que a una cría le miren el vello del pubis para determinar su edad?",1
s_4138,"5.92 INMIGRACIÓN
--------
No hay ningún tenderete del Open Arms en las fronteras con Ucrania, pese al éxodo de un millón de personas. ¿Por qué? Porque allí no hay subvenciones ni trinque. El tito Soros y el Ayuntamiento de Ada Colau abona según el coIor de piel.
(@user)",0
s_2268,"Una fecha aleatoria no, una fecha, antes de la vacunación, y como había gestionado cada uno en medio de la pandemia en el peor momento.
Por cierto quien gestionó la vacunación fueron las CCAA.
La subida de la luz tambien la está gestionando muy bien...",0
s_3940,"Echar a todos los inmigrantes, y con eso tendremos trabajo todos.",1
s_1607,"Valiente tonto  el culo.
Y la ministra aumentado el patrimonio .
Eso que es.
Llenar la panza.
No teneis verguenza",0
s_3429,No te preocupes si le queda poco,0
s_3764,"pero que dices???, como que la situación socieconómica de alguien pueda conllevarle a ser un violador, pero estamos tontos o que",0
s_2947,"Pero que sinvergüenza eres.
Y no te pones ni colorada con tanta MENTIRA COMO ECHAS. Eres vomitiva",0
s_3121,"Son paises liberales. Quieres 50% gasto público? liberaliza la economía haz que crezca.. y por cierto en Epsña ya estamos por encima del 50% lo cual es un desastre. Porque lo que hace falta es más inversión y menos despilfarro. GASTO ÚTIL no subvencionar
URL",0
s_428,"Punto 33. ""Suspender el espacio Schengen hasta que exista la garantía europea de que no lo utilizarán los criminales para huir de la justicia (como han hecho los golpistas separatistas) ni lo aprovechen las mafias de la inmigración ilegal para introducir personas"".",1
s_2896,"Si han aumentado los funcionarios, han dado ERTES a todo el mundo, y son trabajos de verano... Pero de crear empresas y empleo reales cero",0
s_3312,"Pero gilipollas, deje de hablar de progres! Ésto no es una cuestión de progres ni de retrogrados! Ésto es una cuestión de la supervivencia del modelo occidental! Y tú no estás trabajando para ella! Pero claro, España nunca ha sido un modelo del sistema occidental!",0
s_1291,"Preguntarle si le quedan camisetas del Atleti , que a mi me ha bloqueado ..
Ahhhh y calcetines 🧦 ...",0
s_337,"Me encanta ver cada día más juventud que se corre hacia la derecha. Algunos más liberales, otros más conservadores y otros más nacionalistas: pero todos desconfiando de la hegemonía progresista. Se viene una nueva generación políticamente incorrecta.",0
s_3286,"Empezaron con disimulo.
Ahora ya la promueven abiertamente, con descaro y vileza.",0
s_2443,"Aquí no te voy a contestar.., porque tú mismo te retratas solo. (No digo más, al buen entendedor sobran comentarios).",0
s_3360,Por si alguien quiere saber de verdad de qué va el Pacto URL URL,0
s_740,"Seguro que la culpa de que no hay respiradores es del inmigrante, SEGURO.",0
s_1790,"Precisamente esa es la razón principal de los ERTEs: el maquillaje estadístico para q la Ministra pueda sacar pecho.

Cuando acaben los ERTEs y las subvenciones a los autónomos que me cuente como evoluciona la tasa REAL de parados",0
s_1583,"El que es tonto, es tonto por muy temprano que se levante",0
s_23,Eres un cáncer para España. La putada es q no eres el único!😪,0
s_3754,Reconocer que suponen la mayor parte de criminales,0
s_2275,"De los 400K, muchos de los cuales perderán definitivamente su empleo, hablamos otro día",0
s_3036,"Estos no saben que trabajan todos los ministros para hacerlo posible,Economía,agricultura,turismo ,exteriores y el presidente,se pensarán que cuando salen al exterior a traer empresas van hacer turismo",0
s_3911,Dos agentes de @user resultaron heridos el pasado sábado cuando tres inmigrantes magrebíes fueron interceptados en su intento de entrar a la carrera en Melilla por el paso fronterizo de Beni Enzar.,0
s_1961,Te recuerdo que eso son cifras del pp actuamente estamos en el 35% no paso del 38% pese a haber sufrido una pandemia global.,0
s_3209,"Al toro se la agarra por los cuernos pusilánime

empezamos por la Constitución y echar a la secta católica pederastas violadores asesinos gestionadores de campos de mujeres de reeducación y los peores salvajes de la historia",0
s_3931,Hijo de mi vida........ los españoles son el 90% de la población,0
s_233,Equiparación no había antes d entrar los 1600 emigrantes q dices ¡¡¡¡¡¡¡¡¡  y pensiones pocas también,0
s_1668,Imagino que hay que retirarle su acta como diputado cayuco y a su país,0
s_4202,"Ya veréis lo bien que lo van a pasar los progres (LGTBI, feminazis, buenistas etc) cuando tengamos mayoría de musulmanes.
Me voy a poner una chilaba, y disfrutar del espectáculo.
Va a ser memorable.",1
s_1883,"Fuerza @user
Eres la voz de la gente honrada, que solo quiere vivir dignamente de su trabajo, sin robar ni engañar, y de los que, aunque no lo necesitemos, deseamos mejoras para nuestros compatriotas y para los que tienen que huir de la guerra y del hambre
#YoConYolanda",0
s_2902,"Siempre es buena noticia el aumento de contratos laborales, pero digámoslo todo, los contratos basura están ahí, son un porcentaje importante, más q el existente en 2008 y por tanto los tipos d contrato, salarios y estabilidad son peores, más inseguros e irregulares.
#precariedad",0
s_3706,"Hasta ahora los niños/as que migran solos se han enfrentado a desnudos integrales y pruebas invasivas para determinar su edad. Hoy en el #CMin aprobamos el procedimiento judicial que las prohíbe, como dice la Ley Rhodes.

Un gran avance de nuestra Ley de Protección a la Infancia.",1
s_213,Tú y jodete. Racista de mierda. Fuera las fronteras.,0
s_2453,"¿El dinero que cobra un funcionario público y luego lo gasta, cual es su origen?

¿Lo hizo un mago?",0
s_114,"Si, peros eatos politiquillos no los veo en el centro de salud, para ellos sanidad privada, la sanidad publica para la plebe con todos los emigrantes.",1
s_544,"Eso Magalluf, previo pago tasas aeroportuarias, IVAs, imp. alcohol, pago ecotasa y muchos otros más, para que futuros estudiantes prof. @user pueda pagar ESTADO un sueldo. Se realista, tu salario no cae del cielo, y tu pensión de inmigrante ilegal.",1
s_480,Y del dinero que se han pulido de las pensiones ya hablaremos otro día,0
s_166,"Pues como siempre toca pagar a la clase media.
 Si estos gastos tuvieran que pagarlos  todos los políticos de su bolsillo, les aseguro que habría menos fiesta progre !!",0
s_1672,¿Te parece bien así Victoria__86070? URL,0
s_1382,"-Estoy deseando concoer su opinión de la Hanukkah, el Id Al Fitr, Eid al ­Adha, Lama Tsongkhapa, deDiwali, etc...
+Esas no son católicas!
-Ah! perdón...",0
s_1326,"Había que devolverlo a su país, pero con un cañón.",1
s_781,"Es cierto lo de los recortes, pero con con una cifra record máxima que dejo Zapatero de 5.287.000 parados + una seguridad quebrada, ¿ qué se podía hacer?, si usted investiga, los recortes fueron en   despilfarro, atención sanitaria a inmigrantes ilegales excepto emergencias",1
s_4027,"14.10 EL GENERO DE LA VIOLENCIA
"" Agresion de Mujer contra mujer en un piso del Eixample de Barcelona.""
--------------------
Detenida por arrancar el dedo de una mujer de un mordisco y tragárselo URL",0
s_2836,"Lis que pagamos los impuestos que nos corresponden, LOS ASALARIADOS",0
s_1804,A base de contratar personal público maquillas las cifras. Contar la verdad a medias es incluso peor que mentir. No nos tomes por gilipollas...,0
s_2682,"El IPC en el 5,5%, el más alto desde hace treinta años. Es decir, la inflación disparada y TODO ha subido, incluso los productos básicos. Tampoco menciona que lideramos el paro juvenil en Europa…",0
s_1504,"Este negro que se vaya de donde vino ,y deje de dar por culo ...estoy de racista asta los huevos sin tenerlos ...",1
s_3202,"¿Te parece poco la lista que te he pasado? 🤣🤣

Por cierto, ¿los jueces han condenado a Vox por algo? Porque bien que has pedido su ilegalización hace un momento.",0
s_1406,"Que digo yo, que el bien que haría este hombre en su país como adalid de los derechos y la democracia.",1
s_2811,"Ah claro, los caracteres😅 y el desastre colombiano gracias a quién, dices?",0
s_3755,Díselo a Íker Jiménez que solo se indigna si son extranjeros.,0
s_3775,"Muy bien dicho, para los podemonguers solo existe la violencia machista o la de españoles, cuando se trata de extranjeros o de mujeres matando o secuestrando a sus hijos, silencio mediático… son unos demagogos de 💩",1
s_1957,"Mejor q estar 6 millones en la calle, abandonados…la verdad prefiero esto a lo que sufrimos en 2008. Pero a ti eso de empatizar con los q perdieron su trabajo con familia y una mano delante y otra detrás como q no, no? O sin prestaciones…",0
s_3668,"España es el ÚNICO PAÍS EUROPEO que firmará el Pacto para la Inmigración. En España casi no se habla del Pacto para la Inmigración que España firmará el 11 de Diciembre de 2018 en Marrakech, y en el que se compromete a aceptar y mantener a todos los inmigrantes ilegales que entre",1
s_4040,"5.22 INMIGRACIOM
🛑En busca y captura por la @user el marroquí que ayer asfixió e intentó violar a una socorrista en los vestuarios de la Playa de la Concha.

Un caso más en la ola de agresiones sexuales a manos de magrebíes que sufren País Vasco y Cataluña.

(@user)",1
s_1859,"Los valores absolutos no significan nada y tú lo sabes. Y si no lo sabes, haber estudiao.",0
s_1733,"La Fiscalía contra los delitos de odio y discriminación de Barcelona, ha interpuesto una querella contra una usuaria de Twitter, que publicó un vídeo falso, en el que denigraba a menores extranjeros no acompañados que viven en España.",1
s_2000,"Bebes de 30años, camino del subsidio estatal permanente o emigración. Un gran futuro",0
s_3516,"Ha sido tu discurso xenofobo el que te ha librado de ser un ""don nadie"" montado a caballo. No seas desagradecido.",0
s_1975,Este éxito ha sido a pesar de la reforma laboral del PP.,0
s_854,Me estás diciendo que apoyas a las mafias que utilizan a niños para elaborar productos copiados y que utilizan a inmigrantes ilegales para venderlos? Me estás diciendo que apoyas la explotación infantil y de ilegales? Qué hipócrita eres!,1
s_1441,Este señor es un imbécil integral.,0
s_622,"Si... Pero el si que bien recorta la sanidad en Andalucía.
Que hipòcrita el abascalito",0
s_2422,"🤣🤣🤣🤣 que a ti en Podemos te hagan esto no significa que en VOX también lo hagan, tú único recurso es usar el comodín de llamar facha y fascista a quien piense diferente, cosa típica de todos los palurdos zurdos. URL",0
s_3214,"Pero claro para alguno no es bueno por ser una socialdemocracia muy liberal en lo económico incluso algunos la llaman paraíso fiscal.
Por eso a pesar de ser un éxito ni la derecha ni la izquierda en España hablan mucho de los suecos.",0
s_2969,"Ni conoces USA ni el películas, ni sabes lo q es un pobre en USA, te pensarás que en España están mejor🤣🤣🤣

Los parados los compararemos cuando quiten ERTEs y subvenciones y veamos la cifra REAL sin maquillaje, que es lo que te he dicho 20 veces y sigues sin entenderlo, tolili",0
s_4239,"Tienes micha razón y con Podemos en el gobierno,te aseguro q esto va a ponerse peor",0
s_1518,¡ Te puedes ir a la CtM !!,0
s_4205,Igual que hicieron con el Sahara Español en 1975.,1
s_759,"Por qué tienen que estar nuestros abuelos sin medios, cuando han levantado España con su sudor, para darle los medios a inmigrantes ilegales que entraron ayer.
La sanidad gratuita para quien la paga con sus impuestos. Parecemos la ONG del planeta y mientras los nuestros sin nada",1
s_4078,"5.48 INMIGRACION
""Parte de lo q nos llega con la inmigracion descontrolada.
--------
Multiculturalismo magrebí en Gran Canaria, Plaza del Hierro en Maspalomas. Ya tenemos sindicatos ilegales de manteros, Ahorade aparcacoches rompe-caras. (@user)
 URL",1
s_3277,"Para que no se violen? Pero si tienen más derechos que nosotros. Esos si, los deberes de los han dejado al otro lado de la frontera",1
s_3120,"Suecia ya quebró.. y es el último país al que quiero parecerme. Ha sido invadida literalmente por los musulmanes, ha multiplicado por 1000 el número de violaciones, tienen un país hundido por todas las políticas de mierda buenistas que son tóxicas. MENOS SUBVENCIONAR y más crear.",0
s_1091,Qué sabrá este payaso lo que son los Reyes Magos...,0
s_2497,"La crisis comenzó en 2008, pero te recuerdo q fue gestionada pronto x estos solos sin podemos y por tu amado Rajoy que com su reforma nos transformo en esclavos, protegió al rico dejando caer al humilde! Así q tú sigue en tus mundos de fantasía y color azul y verde sub….",0
s_3704,"Con motivo de los movimientos migratorios de mujeres hacia nuestro territorio y la afluencia de personas desplazadas desde Ucrania, @user organiza el 21 de abril una Mesa Debate: “Los derechos de las mujeres extranjeras víctimas de violencia de género”. URL",0
s_3864,"La normativa nacional y europea reconocen el derecho a la información y asesoramiento de las víctimas de violencia de género, pero diversos estudioshan demostrado que este derecho no está garantizado en las mujeres de lengua extranjera. URL",1
s_3969,Si no eres capaz de entender eso...,0
s_4084,"5.53 INMIGRACION
""Ahora, la @user.""
-----------------
Dos menores atracan con violencia a una guardia civil en el barrio de Hadú
#Ceuta.
(@user)
URL",1
s_3400,"De qué país fuerte hablan...? Yo tengo que contentarme con la miseria de los 400€ porque no hay trabajo para alguien que supera los 50, que por cierto a esta hora todavía no me han pagado...",0
s_680,"Si veo mal el 56 que no quieran pagar las intervenciones de reasignación de sexo, pero no viola Derechos Humanos, pues en España no es ni siquiera un derecho habitual. Tampoco veo el 59 que elimina la sanidad gratuita a inmigrantes ilegales, es normal en la mayoría de países 2/4",0
s_1422,"Ala majete, vete a tu país si no te gustan nuestras tradiciones y deja de darnos lecciones, que aquí hasta los republicanos maricones como yo hemos crecido con los Reyes Magos y hemos disfrutado de la tradición sin pensar en vuestras majaderías ideológicas @user",1
s_421,"Punto 16. ""Revisión de los tipos penales (y endurecimiento de sus penas) para combatir a las mafias de la inmigración ilegal, así como para quienes colaboren con ellas, ya sean ONGs, empresas o particulares"".",1
s_3249,"¿Ha dicho algo #SánchezDimisión sobre Sáhara Occidental?
Y si un grupo importante de españoles emigra a Tánger, el rey de Marruecos les dará estado del bienestar?",0
s_1403,Si éste está comiendo de mis impuestos en mi país todo lo que nos pase es poco.,0
s_862,Además dice que los inmigrantes ilegales abusan de la sanidad pública y que no quiere pagar ella para que otros la utilicen y por eso prefiere la sanidad privada URL,1
s_1638,Manipuladores de mierda. Racistas de pacotillas.,0
s_2224,El paro juvenil y los Ertes son imaginarios.,0
s_111,Hay q joderse..... con estos mamarrachos.  Increible URL,0
s_4100,"16.71 GOBIERNO FRANKESTEIN
-----
Brahim Ghali,líder del Polisario,mandó ametrallar a 70 pescadores españoles canarios por pescar en aguas saharauis y violó a una chica española de 18 años. España lo ha acogido en Logroño a escondidas de Marruecos y la sociedad.
(@user )",0
s_2570,"descontado el enorme incremento de funcionarios y comparando con países de nuestro entorno yo no presumiría y menos haría rigideces en la regulación laboral en un rato.  Pero usted misma, el primer problema de los españoles va a decantar el próximo gobierno, no lo accesorio",0
s_41,"Incluidos los 1000 que, sólo ayer, llegaron a las costas andaluzas.
Y a ese ritmo TODOS los que vayan llegando.
Pero no hay dinero para pagar las pensiones... que nos iban a pagar éstos.",1
s_4260,"Los Canarios, tengo amigos allí, están desesperados por lo que está ocurriendo, no pueden ya vivir en su tierra, los están invadiendo y el Gobierno no hace nada. Y como no, lo habitual, a prensa callada.
Los inmigrantes ilegales están robando, violando. No viene turismo.",1
s_1117,"Con lo que hay que acabar, es con esta basura de personajes",0
s_3980,Son personas ante todo no ? O es que los ilegales les hacen ser menos. Personas o tienen 4 ojos? Ay! que facil es hablar! Deberías de preguntarle a algún español ilegal que está en mi país si es fácil ganarse el pan de cada día,0
s_1976,"Yo, me alegro que haya menos paro, si.",0
s_2794,"El caso dd Barcelona es como el dd San Sebastián, el problema es que no hay más terreno, aún así el suelo no está liberalizado, el ayuntamiento tiene su PGOU y es quien dice donde se puede, cómo y que se puede edificar, con el suelo liberalizado esto no sucedería.",0
s_2999,"Los que están en erte no están sin trabajo. Algunos trabajan parcialmente. En el caso de mi hermana, automoción, es por la carencia de microchips, no por la pandemia. Toma nota.",0
s_2251,No es exacto. Y has olvidado mencionar que ha sido gracias a la reforma laboral del PP que queréis derogar. Para muestra un botón. URL,0
s_229,No mereces ninguna respuesta sino la indiferencia y el olvido,0
s_1355,Que ponga orden en su país de origen que seguro allí no respetan nada...barcoo,1
s_955,Debería volverse a su país a eliminar tradiciones allí.,1
s_2026,"Me molesta soberanamente la gente que contesta con emoticonos y tonterías porque no tiene recursos.
Te bloqueo porque no aportas nada, para ver dibujaros voy a Disney+.",0
s_2952,A mí por lo menos no me engaña esa panda de mangantes y farsantes.,0
s_2543,"Más que nunca precariedad laboral y temporalidad, la ministra que no sabía que en ERTE se cobra el 70 por ciento",0
s_2451,"El INE no engaña. Ahí están los datos oficiales, única fuente fiable. Los que hablan de mentiras deben indicar cuáles son sus fuentes. A por la reforma laboral y por el empleo digno, YA!!",0
s_794,"Que todos somos iguales es una falazia, la sanidad debe atender a todos los españoles o inmigrantes que coticen, porque según tú regla de tres ¿porque vamos a pagar los españoles si a los ilegales les atienden primero y mejor?. Lo que debemos hacer es pagarles su pasaje a casa.",1
s_808,"La realidad es cabrona, Echenique, en este caso también. Como cuando dijiste que el coronavirus era ""solo una gripe menos agresiva que la de todos los años"".
Ay, Echenique, la realidad y tú. Qué emotiva historia de desamor. URL",0
s_1288,Este hay que mandalo a su pais y alli que haga quite y diga lo que quiera que cojones es esto? Viene un tio que no conoce ni la historia ni las tradiciones y se mea y se caga en todo? Estamos tontos? O que pasa,1
s_2972,"Sí, muy gordos y bien puestos, la verdad puede ser revolucionaria. 😘",0
s_1444,¿Donde coño esta el racismo en un grupo m de tres miembros que representan distintas etnias presentes en España y que comparten el mismo título de soberanía?,0
s_1621,"Ojalá sea verdad, y acabar también con estos folletos digitales nauseabundos.",0
s_2801,"Q produce un funcionario público...si cierran empresas,industrias, comercios q producen y /o venden productos quienes lo harán por ellos,evidente q los funcionarios no van a ser...aumento del gasto de estado comprando empleos q sirven para votos, eso es ya conocido en otros lados",0
s_3836,En ningún momento he dicho eso. Observo que no dominas el idioma español.,0
s_9,"En las próximas elecciones seguiremos como estamos, jodidos",0
s_3677,"España es el ÚNICO PAÍS EUROPEO que firmará el Pacto para la Inmigración. En España casi no se habla del Pacto para la Inmigración que España firmará el 11 de Diciembre de 2018 en Marrakech, y en el que se compromete a aceptar y mantener a todos los inmigrantes ilegales que entr",0
s_2343,"Si, sobre todo han aumentado los funcionarios, los asesores y otros que cobran del erario público...",0
s_2875,"No es nuevo eso:  ya se lo decía todo el mundo a Aznar y Rajoy cuando sacaban pecho por bajar el paro a base de ETT's floreciendo como champiñones por toda España, abaratar despidos, promover contratos de risa y fomentar hipotecas al 110%.
Pero entonces la derechona, chitón. 🤫",0
s_3669,"NO.

España no es “el único país europeo que firmará el pacto para la inmigración”.

Alemania, Portugal, Bélgica y Grecia, entre otros, también lo firman.

El pacto tampoco dice que “se vaya a mantener a todos los inmigrantes ilegales que entren al país”. URL",0
s_4183,"Consentido por gobiernos de todos los colores, inútiles e irresponsables que solo miran por sus bolsillos.",0
s_456,1a manipulación: Inmigración #ILEGAL que es muy distinto a la Legal que la defendemos.,0
s_3903,Dejé de leer cuando vi que el estudio al que se hace referencia es hasta 2013!!!! Cojan un estudio actual y hablamos de porcentajes...,0
s_2983,"No, tú eres más de los que se lo llevan en B.",0
s_4129,"5.86 Inmigracion
Y van...
--
10 marroquíes (varios MENAS) han dado una paliza en el centro de Madrid a una chica a la q incluso han destrozado varios dientes.
El suceso ocurrió el sábado 28 de Agosto, pero una orden política secuestró la información hasta hoy.
BASTA.
(@user )",1
s_487,#a que inmigrante le dan “paguita” como se llama esa paguita???a quien les han dado “casa” gratis??? Si solo puedes decir barbaridades vacías y huecas eres el típico votante q se vende por el bocata ..pais de ignorantes,1
s_1052,Que este elemento esté en el Congreso de los Diputados.. dice del puto complejo que tenemos en España. Sólo espero que VOX meta en un avión a todos estos chuflas y los devuelva a su puñetera casa.,1
s_176,"Con no robar, sobra.",0
s_3535,"Qué vas a decir los ultras nazis siempre hacéis lo mismo mentir a la gente manipulando con mentiras,pero de verdad me das pena Abascal porque no tienes que estar bien de la chota",0
s_2767,"Ser inmigrante no te hace mas delincuente . Estar en la miseria o en la pobreza si . Son datos . El color de la piel no te hace ser más delincuente . Si no lo entiendes así , solo me falta sacarte marionetas . Pero yo cobro por enseñar . Un saludo .",0
s_2549,"Si supieras algo de VOX sabrías que lo importante para sus votantes es que sólo queremos que los políticos nos dejen ser lo más libres posibles y que cada uno sea cómo sea, no queremos ser cómo nadie. No hay mayor tonto que el obrero que vota a izquierdas la historia lo demuestra",0
